,source,author,title,description,url,urlToImage,publishedAt,content
112,"{'id': 'the-verge', 'name': 'The Verge'}",Emma Roth,"Data breach leaks SSNs of over 230,000 Comcast customers","A data breach at a debt collection agency has leaked the information of over 230,000 Comcast customers.",https://www.theverge.com/2024/10/7/24264283/comcast-fcbs-data-breach-ssn-names,https://cdn.vox-cdn.com/thumbor/iDfGkmDLIRjK4JkXVyRStrbq6D0=/0x0:2040x1360/1200x628/filters:focal(1020x680:1021x681)/cdn.vox-cdn.com/uploads/chorus_asset/file/23318435/akrales_220309_4977_0232.jpg,2024-10-07T16:02:34Z,"Data breach leaks SSNs of over 230,000 Comcast customers
Data breach leaks SSNs of over 230,000 Comcast customers
 / A ransomware attack at a debt collection agency used by Comcast leaked info dati… [+1655 chars]"
113,"{'id': 'the-verge', 'name': 'The Verge'}",Ash Parrish,Netflix closes AAA game studio before it ever released a game,"Netflix has quietly shut down one of its gaming studios, the first publicly disclosed shuttering since Netflix began its gaming program in 2021.",https://www.theverge.com/2024/10/22/24276700/netflix-gaming-studio-closure-blue,https://cdn.vox-cdn.com/thumbor/ScXzGQ8lrcWwmyFEyuCWvqtTjPE=/0x0:2040x1360/1200x628/filters:focal(1020x680:1021x681)/cdn.vox-cdn.com/uploads/chorus_asset/file/23951360/STK072_VRG_Illo_N_Barclay_8_netflix.jpg,2024-10-22T15:23:28Z,"Netflix closes AAA game studio before it ever released a game
Netflix closes AAA game studio before it ever released a game
 / The studio, known as Blue, was developing a multiplatform AAA game for… [+1712 chars]"
114,"{'id': None, 'name': 'Hackaday'}",Kristina Panos,Keebin’ with Kristina: the One with the Folding Butterfly Keyboard,"Want to give prospective employers a business card that doesn’t immediately get tossed? Of course you do. If you’re one of us, the answer is obvious: make it some kind of a PCB. But as …",https://hackaday.com/2024/10/16/keebin-with-kristina-the-one-with-the-folding-butterfly-keyboard/,https://hackaday.com/wp-content/uploads/2021/07/Keebin.jpg,2024-10-16T17:00:13Z,"Want to give prospective employers a business card that doesn’t immediately get tossed? Of course you do. If you’re one of us, the answer is obvious: make it some kind of a PCB.
Image by [Ricardo Da… [+4913 chars]"
115,"{'id': None, 'name': '[Removed]'}",,[Removed],[Removed],https://removed.com,,2024-10-30T11:17:12Z,[Removed]
116,"{'id': None, 'name': 'Hubspot.com'}",Jamie Pitman,60 Best Online Local Business Directories & Listing Sites,"Promoting a local business can be challenging these days. Whether it’s because of oversaturation or complicated search engine algorithms, it’s all too easy to feel like no one will find your business in the local search results.",https://blog.hubspot.com/marketing/tabid/6307/bid/10322/the-ultimate-list-50-local-business-directories.aspx#article,https://www.hubspot.com/hubfs/local-business-directories-1-20241024-9244305.webp,2024-10-25T11:00:00Z,"Promoting a local business can be challenging these days. Whether its because of oversaturation or complicated search engine algorithms, its all too easy to feel like no one will find your business i… [+30467 chars]"
117,"{'id': None, 'name': 'Hubspot.com'}",Colby Boone,My Advice for People of Color Looking to Break Into Tech,"Welcome to Breaking the Blueprint — a blog series that dives into the unique business challenges and opportunities of underrepresented business owners and entrepreneurs. Learn how they’ve grown or scaled their businesses, explored entrepreneurial ventures wit…",https://blog.hubspot.com/marketing/poc-in-tech#article,https://www.hubspot.com/hubfs/poc%20in%20tech.webp,2024-10-10T11:00:00Z,Welcome toBreaking the Blueprint a blog series that dives into the unique business challenges and opportunities of underrepresented business owners and entrepreneurs. Learn how theyve grown or scaled… [+5697 chars]
118,"{'id': 'wired', 'name': 'Wired'}",Alex Prewitt,How a 12-Ounce Layer of Foam Changed the NFL,"Even the makers of the Guardian Cap admit it looks silly. But for a sport facing an existential brain-injury crisis, once unthinkable solutions have now become almost normal.",https://www.wired.com/story/nfl-guardian-caps-hanson-concussions-cte/,"https://media.wired.com/photos/67040efa7cbaf2640d5f3b6d/191:100/w_1280,c_limit/guardian-helmets-sci-.jpg",2024-10-17T21:48:02Z,"But they soon found their first big believer. That year, at a medical conference in Destin, Flaorida, the Hansons met Jeffrey Guy, a physician for the University of South Carolina athletic department… [+2564 chars]"
119,"{'id': 'wired', 'name': 'Wired'}",Vittoria Elliott,Elon Musk's America PAC Has Created an Election Denial Cesspool on X,"The group has nearly 50,000 members, many enthusiastically sharing debunked claims about voting fraud. “It's just an election denier jamboree,” says one expert.",https://www.wired.com/story/elon-musk-america-pac-election-denial-community-x/,"https://media.wired.com/photos/6723d28fe9642f2551fc93df/191:100/w_1280,c_limit/musk-michigan-pol-1757147063.jpg",2024-10-31T19:37:10Z,"For months, billionaire and X owner Elon Musk has used his platform to share election conspiracy theories that could undermine faith in the outcome of the 2024 election. Last week, the political acti… [+2472 chars]"
120,"{'id': 'wired', 'name': 'Wired'}",Makena Kelly,A Running List of the Tech CEOs Donald Trump Claims Are Calling Him to Suck Up,"Some of the most powerful people in Silicon Valley appear to be quietly sitting out the presidential election cycle. But Trump says that in private, it's a different story.",https://www.wired.com/story/tech-ceos-trump-claims-are-courting-him/,"https://media.wired.com/photos/671f9d3d2c0fb6f2c687a28a/191:100/w_1280,c_limit/GettyImages-2176994436.jpg",2024-10-28T18:08:54Z,"With only a few days left until the US presidential election, Donald Trump is claiming that some of Silicon Valleys most powerful billionaires and tech leaders are seeking him out.
Many of these lea… [+2154 chars]"
121,"{'id': None, 'name': 'Hubspot.com'}",Alana Chinn,‘Not Your Mom’s Facebook’ — Is It Enough to Attract Gen Z?,"Welcome to The Perspective, a series where HubSpotters weigh in on the latest business and marketing trends.",https://blog.hubspot.com/marketing/can-facebook-attract-gen-z#article,https://www.hubspot.com/hubfs/can-Facebook-attract-Gen-Z-1-20241022-5758148.webp,2024-10-23T11:00:00Z,"Welcome to The Perspective, a series where HubSpotters weigh in on the latest business and marketing trends.
We are not your moms Facebook.
This bold statement was passed around at Facebooks event … [+7125 chars]"
122,"{'id': None, 'name': 'Yahoo Entertainment'}",Kris Holt,"AMD's next-gen GPUs are set to arrive in early 2025, suggesting a CES reveal","AMD and NVIDIA could be on a collision course for CES. AMD CEO Lisa Su has confirmed for the first time that the company is set to release its next-gen PC GPUs early next year.
""In gaming graphics, revenue declined year-over-year as we prepare for a transitio…",https://consent.yahoo.com/v2/collectConsent?sessionId=1_cc-session_70b99d4c-dcfb-4df3-b149-e8012654e27f,,2024-10-30T19:26:30Z,"If you click 'Accept all', we and our partners, including 237 who are part of the IAB Transparency &amp; Consent Framework, will also store and/or access information on a device (in other words, use … [+678 chars]"
123,"{'id': None, 'name': 'BBC News'}",,Minister put on spot over 'working people' definition,"Treasury minister James Murray was pressed on what makes someone a ""working"" person ahead of next week's Budget.",https://www.bbc.com/news/videos/c86q911v8q8o,https://ichef.bbci.co.uk/news/1024/branded_news/f4b0/live/8320e2b0-92ae-11ef-89ae-5575c76d98e6.jpg,2024-10-25T09:00:08Z,"Treasury minister James Murray was asked to define ""working people"" amid speculation that the chancellor could raise some taxes in the Budget next week.
Murray said the government will keep its mani… [+459 chars]"
124,"{'id': None, 'name': 'heise online'}",Richard Seidl,Podcast Software Testing: Business Analyst mit Qualitätsblick,In dieser Podcast-Folge spricht Richard Seidl mit Phillip Huber über die Qualität von Anforderungen und wie diese sichergestellt werden kann.,https://www.heise.de/blog/Podcast-Software-Testing-Business-Analyst-mit-Qualitaetsblick-10003257.html?wt_mc=rss.red.ho.ho.atom.beitrag.beitrag,https://heise.cloudimg.io/bound/1200x1200/q85.png-lossy-85.webp-lossy-85.foil1/_www-heise-de_/imgs/18/4/7/0/0/7/4/2/business_analyst_2560x1440-21b08dbaf1dbf36a.jpg,2024-11-05T07:04:00Z,"Richard Seidl begrüßt in dieser Folge des Podcasts Software Testing Philipp Huber, einen Business-Analysten, der früher als Tester gearbeitet hat. Sie sprechen darüber, wie Hubers Testerfahrungen sei… [+989 chars]"
125,"{'id': None, 'name': 'Yahoo Entertainment'}",Janet Eastham,Scientologist farmer ‘cut’ from family’s £80m potato and onion dynasty,"A farmer from an £80 million Norfolk onion and potato dynasty has claimed he is being cut out of the business because he is a Scientologist, a court has...",https://uk.news.yahoo.com/scientologist-farmer-sues-family-over-141704934.html,https://media.zenfs.com/en/the_telegraph_818/62bc36b88e2afec9311e003b52814be7,2024-11-04T14:17:04Z,"A farmer from an £80 million Norfolk onion and potato dynasty has claimed he is being cut out of the business because he is a Scientologist, a court has heard.
RG Abrey farm, near East Wretham, Thet… [+4317 chars]"
126,"{'id': None, 'name': 'BBC News'}",,Indian tycoon Ratan Tata dies aged 86,"His death was announced by the Tata Group, the conglomerate he led for more than two decades.",https://www.bbc.com/news/articles/cjd5835mp4ko,https://ichef.bbci.co.uk/news/1024/branded_news/f815/live/62c4d2a0-8670-11ef-92fd-27c0cd0dd571.jpg,2024-10-09T18:56:07Z,"Ratan Tata was one of India's most internationally recognised business leaders
Indian tycoon Ratan Tata has died aged 86, says the Tata Group, the conglomerate he led for more than two decades.
Tat… [+2083 chars]"
127,"{'id': 'business-insider', 'name': 'Business Insider'}",Lara O'Reilly,PayPal just opened a new ad business. The exec leading it unpacks the plan to link advertisers with its trove of transaction data.,"PayPal Ads intends to offer ads across its own properties, as well as the sites of tens of millions of merchants that use its payments tech.",https://www.businessinsider.com/paypal-is-launching-a-retail-media-ad-network-plan-2024-10,https://i.insider.com/6706e14a198738e3a70f7806?width=1200&format=jpeg,2024-10-10T09:00:02Z,"Mark Grether helped build Uber Ads into a $1 billion business. Now he wants to grow PayPal's ad business.PayPal
<ul><li>PayPal is set to launch an ad business, starting in the US.</li><li>The compan… [+4408 chars]"
128,"{'id': 'wired', 'name': 'Wired'}",Amy Francombe,High-End Fashion Dupes Are Soaring Where Knock-Offs Never Could,"High-quality imitations of luxury products are rising, and people aren't ashamed to buy them anymore. How do designer brands retain their appeal?",https://www.wired.com/story/high-end-fashion-dupes-are-soaring-where-knock-offs-never-could/,"https://media.wired.com/photos/67098f645bd6f05ea989c116/191:100/w_1280,c_limit/dupe-handbags-gear.jpg",2024-10-13T10:00:00Z,"They are the architects of their own problems, continues Sherwood. By making so much of their products not about the tangible product, but about the intangible aspects of the brands - those sexy ads,… [+4131 chars]"
129,"{'id': None, 'name': 'BBC News'}",,Government mulls giving workers twice as long to strike,A document produced by the government says the mandate to strike could be extended to a year from six months.,https://www.bbc.com/news/articles/cx279nypygvo,https://ichef.bbci.co.uk/news/1024/branded_news/0f2f/live/d9017640-9169-11ef-995d-c3b470c11f78.jpg,2024-10-23T18:26:20Z,"The government is considering giving workers twice as long to strike.
Under existing legislation, if workers vote to take industrial action, the mandate expires after six months and unions are requi… [+3046 chars]"
130,"{'id': None, 'name': 'Slashdot.org'}",msmash,"More Than 60% of CEOs Are 'Digitally Illiterate', According To Their Own Employees","Corporate resistance to AI tools is costing employees six hours per week in manual tasks that could be automated, according to research by recruitment firm SThree. Sixty-three percent of workers blame management's ""digital illiteracy"" for slow AI adoption, de…",https://tech.slashdot.org/story/24/11/01/185209/more-than-60-of-ceos-are-digitally-illiterate-according-to-their-own-employees,https://a.fsdn.com/sd/topics/ai_64.png,2024-11-01T18:05:00Z,"Us trench troops know that many managers are just as clueless abut not just AI, but the very own tech they people they manage work on.
I see it on daily display where I'm at. Network mgr will come o… [+213 chars]"
131,"{'id': 'the-verge', 'name': 'The Verge'}",Gaby Del Valle,Marriott agrees to pay $52 million settlement after multiple data breaches,"The FTC is also requiring Marriott and its Starwood subsidiary to implement an information security program to settle charges over three data breaches that occurred between 2020 and 2024, affecting 334 million customers.",https://www.theverge.com/2024/10/10/24267048/marriott-ftc-settlement-agreement-52-million-fine,https://cdn.vox-cdn.com/thumbor/xyGsX1bbhe6XLTDz3Vpmv_Hd-hI=/0x0:1000x667/1200x628/filters:focal(500x334:501x335)/cdn.vox-cdn.com/uploads/chorus_asset/file/3360954/shutterstock_219795124.0.jpg,2024-10-10T17:02:27Z,"Marriott agrees to pay $52 million settlement after multiple data breaches
Marriott agrees to pay $52 million settlement after multiple data breaches
 / The hotel chain and its Starwood subsidiary … [+2245 chars]"
132,"{'id': 'the-verge', 'name': 'The Verge'}",Emma Roth,WordPress co-founder asks court to dismiss WP Engine’s lawsuit,WordPress cofounder and Automattic CEO Matt Mullenweg has filed a motion to dismiss WP Engine’s lawsuit against it.,https://www.theverge.com/2024/10/31/24284537/wordpress-court-dismiss-wp-engine-lawsuit,https://cdn.vox-cdn.com/thumbor/NhK0m7qvXWPvgzTCeAfLesVSmRY=/0x0:2040x1360/1200x628/filters:focal(1020x680:1021x681)/cdn.vox-cdn.com/uploads/chorus_asset/file/25654312/STK302_WORDPRESS_B.jpg,2024-10-31T16:31:46Z,"WordPress cofounder asks court to dismiss WP Engines lawsuit
WordPress cofounder asks court to dismiss WP Engines lawsuit
 / Matt Mullenweg claims he has no obligation to provide WP Engine with acc… [+2043 chars]"
133,"{'id': 'the-verge', 'name': 'The Verge'}",Jay Peters,More than a quarter of new code at Google is generated by AI,Google CEO Sundar Pichai says that more than a quarter of all new code at Google is generated by AI. He made the announcement on company’s third quarter 2024 earnings call.,https://www.theverge.com/2024/10/29/24282757/google-new-code-generated-ai-q3-2024,https://cdn.vox-cdn.com/thumbor/EaScurH_lVme4X1artA78Qh3lpo=/0x0:2040x1360/1200x628/filters:focal(1020x680:1021x681)/cdn.vox-cdn.com/uploads/chorus_asset/file/24016888/STK093_Google_01.jpg,2024-10-29T21:05:28Z,"More than a quarter of new code at Google is generated by AI
More than a quarter of new code at Google is generated by AI
 / AI is hugely important to Googles products, and it sounds like the compa… [+2307 chars]"
134,"{'id': 'the-verge', 'name': 'The Verge'}",Thomas Ricker,Miniot’s split-flap clock is what nostalgia sounds like,"Miniot’s Klapklok primarily functions as a clock, showing the hour and minute hands using 69 (nice) “paper-like” flaps that act like black and white pixels.",https://www.theverge.com/2024/10/31/24283510/miniot-klapklok-low-resolution-wall-clock-price,https://cdn.vox-cdn.com/thumbor/suzf_ekdVDe1B8Rxz-_ibXjVeqs=/0x0:960x960/1200x628/filters:focal(503x341:504x342)/cdn.vox-cdn.com/uploads/chorus_asset/file/25706402/KlapKlokBruinKlein.jpeg,2024-10-31T09:11:49Z,"Miniots split-flap clock is what nostalgia sounds like
Miniots split-flap clock is what nostalgia sounds like
 / Klapklok makes paying more for less resolution justifiable.
ByThomas Ricker, a depu… [+2021 chars]"
135,"{'id': 'the-verge', 'name': 'The Verge'}",Ash Parrish,Nintendo says its Switch successor will be backward compatible with Switch games,Nintendo says the successor to the Switch will be backward compatible with its games and the Nintendo Switch Online service.,https://www.theverge.com/2024/11/5/24284745/switch-2-backward-compatibility-nintendo-online-preservation,https://cdn.vox-cdn.com/thumbor/8JWRw_HOuKfVhERv2SqVFVojZjE=/0x0:2040x1360/1200x628/filters:focal(1020x680:1021x681)/cdn.vox-cdn.com/uploads/chorus_asset/file/25590106/STK054_NINTENDO_D.jpg,2024-11-06T01:42:50Z,"Nintendo says its Switch successor will be backward compatible with Switch games
Nintendo says its Switch successor will be backward compatible with Switch games
 / The company says that Nintendo S… [+2428 chars]"
136,"{'id': None, 'name': 'Gizmodo.com'}",Matt Novak,Kroger’s Plan to Use Facial Recognition Raises Concerns About Surge Pricing,How soon will the Minority Report-style supermarket arrive?,https://gizmodo.com/krogers-plan-to-use-facial-recognition-raises-concerns-about-surge-pricing-2000512685,https://gizmodo.com/app/uploads/2024/10/kroger-kentucky.jpg,2024-10-16T19:35:52Z,Democratic congresswoman Rashida Tlaib recently sent a letter to Kroger over the grocery giant’s purported plan to introduce digital price tags that could be changed in an instant to raise or lower p… [+3833 chars]
137,"{'id': None, 'name': 'Hubspot.com'}",juthompson@hubspot.com (Justina Thompson),"Jade Walters is Creating Opportunities for Students of Color on LinkedIn, Here’s How [+ Pro Tips for Gen Z]","Welcome to Breaking the Blueprint — a blog series that dives into the unique business challenges and opportunities of underrepresented business owners and entrepreneurs. Learn how they’ve grown or scaled their businesses, explored entrepreneurial ventures wit…",https://blog.hubspot.com/marketing/gen-z-poc-on-linkedin#article,https://knowledge.hubspot.com/hubfs/gen-z-linkedin-1-20240930-6717535.webp,2024-10-21T11:00:00Z,Welcome to Breaking the Blueprint a blog series that dives into the unique business challenges and opportunities of underrepresented business owners and entrepreneurs. Learn how theyve grown or scale… [+13728 chars]
138,"{'id': None, 'name': 'Hubspot.com'}",Kasia Kowalska,AI Conversion Rate Optimization — What Are the Benefits & How to Use It in Your Business,"Being a marketer is hard — I feel it’s always been this way, but now the pressure to deliver results is even higher. Companies are cutting their marketing budgets and watching every penny before deciding what to spend it on.",https://blog.hubspot.com/marketing/ai-conversion-rate-optimization#article,https://www.hubspot.com/hubfs/ai-conversion-rate-optimization-1-20241027-3732181.webp,2024-10-28T11:00:00Z,"Being a marketer is hard I feel its always been this way, but now the pressure to deliver results is even higher. Companies are cutting their marketing budgets and watching every penny before decidin… [+13673 chars]"
139,"{'id': 'business-insider', 'name': 'Business Insider'}",Erin Liam,"After 5 years in tech, I wanted something new. An internship on a tea farm in Japan was the wake-up call I needed.","As part of her MBA, Cherie Luo interned on a matcha farm near Kyoto, Japan. It made her reflect on being in ""hyper-growth mode"" all the time.",https://www.businessinsider.com/stanford-student-internship-matcha-tea-farm-japan-what-she-learned-2024-10,https://i.insider.com/66fe022a7de5c8fd4834dfb5?width=1200&format=jpeg,2024-10-09T02:44:16Z,"Cherie Luo interned at a matcha farm for four weeks, where she helped out with the business aspect of the farm.Cherie Luo
<ul><li>Cherie Luo worked at a matcha farm as part of a requirement during h… [+5151 chars]"
140,"{'id': 'business-insider', 'name': 'Business Insider'}",Dominick Reuter,I visited Texas to see Sam's Club's store of the future. It was brimming with tech.,"The newly opened Sam's Club in Grapevine, Texas, is a high-tech model for future stores. You won't find any checkout lanes inside.",https://www.businessinsider.com/sams-club-store-without-checkouts-grapevine-texas-2024-10,https://i.insider.com/6716a2a001ea6d83dee2dd67?width=1200&format=jpeg,2024-10-22T10:13:01Z,"Shoppers walk through the new AI gateways at Sam's Club in Grapevine, Texas.Dominick Reuter/Business Insider
<ul><li>Sam's Club recently opened its first new location in seven years in Grapevine, Te… [+10083 chars]"
141,"{'id': None, 'name': '[Removed]'}",,[Removed],[Removed],https://removed.com,,2024-10-21T22:25:23Z,[Removed]
142,"{'id': 'business-insider', 'name': 'Business Insider'}",Erin McDowell,"I shopped at Anthropologie and Target for fall decor. One store had a wider selection, but the other had more discounts.","Target and Anthropologie both sold autumnal decor for the fall season, from pillows to candles. However, before Halloween, a lot of it was gone.",https://www.businessinsider.com/fall-thanksgiving-decor-shopping-target-vs-anthropologie-2024-10,https://i.insider.com/6720faada0a0cc14f2249279?width=1200&format=jpeg,2024-10-31T15:28:59Z,"Target and Anthropologie both sold autumnal decor for the fall season, from pillows to candles.Erin McDowell/Business Insider
<ul><li>I stopped by Target and Anthropologie a week before Halloween to… [+15136 chars]"
143,"{'id': None, 'name': '9to5Mac'}",Ryan Christoffel,iOS 18.1 upgrades business messaging with RCS support,"Apple has a packed iOS 18.1 update coming next week, with Apple Intelligence and a whole lot more. But despite months of beta testing, there’s one new feature we just learned about today: iOS 18.1 upgrades business messaging to include RCS support.



 more…",https://9to5mac.com/2024/10/21/ios-18-1-upgrades-business-messaging-with-rcs-support/,https://i0.wp.com/9to5mac.com/wp-content/uploads/sites/6/2024/10/messages-for-business-homedepot.jpg?resize=1200%2C628&quality=82&strip=all&ssl=1,2024-10-21T17:58:12Z,"Apple has a packed iOS 18.1 update coming next week, with Apple Intelligence and a whole lot more. But despite months of beta testing, theres one new feature we just learned about today: iOS 18.1 upg… [+1067 chars]"
144,"{'id': None, 'name': 'heise online'}",Dirk Knop,SAP-Patchday: Sechs neu gemeldete Sicherheitslücken in Business-Software,"Der Patchday im Oktober von SAP bringt wenige Aktualisierungen. Sechs Lücken stopfen die Entwickler neu, zwei davon sind hochriskant.",https://www.heise.de/news/SAP-Patchday-Sechs-neu-gemeldete-Sicherheitsluecken-in-Business-Software-9971616.html,https://heise.cloudimg.io/bound/1200x1200/q85.png-lossy-85.webp-lossy-85.foil1/_www-heise-de_/imgs/18/4/6/8/4/4/9/8/2024-04-09-Bing_Designer-SAP_SIcherheitsluecke-4-huebsche_BEine-2160px-d05cdeab621b799f.png,2024-10-08T10:32:00Z,Im Oktober bekommen SAP-Admins weniger Arbeit als üblich: Lediglich sechs neue Sicherheitslücken stopfen die Walldorfer Entwickler in der Business-Software. Zudem aktualisieren sie die Sicherheitsnot… [+1879 chars]
145,"{'id': None, 'name': 'Gettalong.org'}",,10 Years of HexaPDF,A look at the last 10 years of implementing HexaPDF and creating a business around it,https://gettalong.org/blog/2024/10-years-of-hexapdf.html,https://gettalong.org/blog/feature-images/celebration.jpg,2024-10-27T01:26:53Z,"A look at the last 10 years of implementing HexaPDF and creating a business around it
I have been implementing HexaPDF for the last 10 years now and just released version 1.0.0. It
all started due … [+16206 chars]"
146,"{'id': 'buzzfeed', 'name': 'Buzzfeed'}",Ashley Holt,"A Fox News Host Seemingly Tried To Defend Trump Allegedly Saying He Wanted ""Generals Like Hitler Had,"" And It's Quite The Statement","""Coming from the business world...obviously [Trump] has frustration.""View Entire Post ›",https://www.buzzfeed.com/ashleyholt1/fox-news-host-defends-trump,"https://img.buzzfeed.com/buzzfeed-static/static/2024-10/23/21/enhanced/7e611601ac9d/original-2408-1729720296-2.jpg?crop=1247:653;0,1%26downsize=1250:*",2024-10-24T19:08:29Z,"Make your vote count! Learn more about how to register, important deadlines, and your state's mail-in voting options here. For more on the 2024 election, check out coverage on BuzzFeed, HuffPost, and… [+9 chars]"
147,"{'id': None, 'name': 'BBC News'}",,Boeing withdraws pay rise offer to striking workers,The aviation giant accused the union of not giving its proposals serious consideration.,https://www.bbc.com/news/articles/c5y064gz1e3o,https://ichef.bbci.co.uk/news/1024/branded_news/e24e/live/224922e0-85e8-11ef-876f-e9a5602c6c93.jpg,2024-10-09T03:24:59Z,"Boeing says it has withdrawn its pay rise offer to striking workers after negotiations with union representatives reached a stalemate.
The aviation giant accused the union of not giving its proposal… [+1179 chars]"
148,"{'id': 'fox-news', 'name': 'Fox News'}","Kurt Knutsson, CyberGuy Report",Someone reinvented the toilet so that you can do your business anywhere,"Kurt “CyberGuy"" Knutsson reveals how the Generation 2 Reinvented Toilet transforms waste into safe materials, a promising sanitation solution that could transform lives and communities.",https://www.foxnews.com/tech/someone-reinvented-toilet-so-you-can-do-your-business-anywhere,https://static.foxnews.com/foxnews.com/content/uploads/2024/10/1-innovative-off-grid-toilet-is-a-game-changer-for-doing-your-business-anywhere.jpg,2024-10-09T10:00:20Z,"Have you ever considered how access to proper sanitation affects health, dignity and the environment?
In a groundbreaking move, the pioneering water and housing products company LIXIL secured its po… [+3514 chars]"
