,source,author,title,description,url,urlToImage,publishedAt,content
220,"{'id': None, 'name': 'Gizmodo.com'}",Matthew Gault,"With Putin Calls, It’s More Clear Than Ever That Elon Musk Is a National Security Threat",The billionaire has been chatting with Russia's authoritarian leader for years while he stumps for Trump and commands huge government contracts.,https://gizmodo.com/with-putin-calls-its-more-clear-than-ever-that-elon-musk-is-a-national-security-threat-2000516544,https://gizmodo.com/app/uploads/2024/10/MuskAmerica.jpg,2024-10-25T15:46:45Z,"Its been a wild few days for tech billionaire Elon Musk. On Wednesday, the Justice Department warned him that his $1 million giveaway to swing state voters might be illegal. And then on Thursday The … [+4898 chars]"
221,"{'id': None, 'name': 'Digital Trends'}",Michael Bizzaco,This Dell business laptop is $350 off for a limited time,"Own a laptop you’ll never have to worry about when you take home the Dell Latitude 5550, now on sale for $350 at Dell.",https://www.digitaltrends.com/computing/dell-latitude-5500-deal-dell-october-2024/,https://www.digitaltrends.com/wp-content/uploads/2024/10/dell-latitude-5550-laptop-render-2.jpg?resize=1200%2C630&p=1,2024-10-25T17:20:11Z,"Dell
A great laptop should do more than fire up Windows and allow you to browse the web. You’ll want a powerful computer that can keep up with your lifestyle. Whether that means providing enough int… [+1798 chars]"
222,"{'id': None, 'name': 'Gizmodo.com'}",Dua Rashid,This Toilet Seat Has a Camera for Taking Pictures of Your Poop,"The seat's camera uses ""artificial gut intelligence"" to help identify any potential digestive health issues.",https://gizmodo.com/this-toilet-seat-has-a-camera-for-taking-pictures-of-your-poop-2000514322,https://gizmodo.com/app/uploads/2024/10/throne-toilet-seat.jpg,2024-10-21T15:19:27Z,"I’ve been uncomfortable ever since I learned (via TechCrunch) about this toilet seat with a camera that takes pictures of your poop. Courtesy of an Austin-based health startup, Throne, this seat is c… [+2283 chars]"
223,"{'id': None, 'name': 'Gizmodo.com'}",Brittany Vincent,"Time Doesn’t Wait, This 26% Off Canon Portable Document Scanner Will Last Until Tonight Only for Prime Day","Preserve and save everything from receipts to bank statements and everything in between, thanks to this prime day deal.",https://gizmodo.com/time-doesnt-wait-this-26-off-canon-portable-document-scanner-will-last-until-tonight-only-for-prime-day-2000510186,https://gizmodo.com/app/uploads/2024/10/canon-document-scanner.jpg,2024-10-09T21:47:46Z,"Physical paper isn’t always forever. It’s more important than ever these days to keep your important documents safe and easily accessible. You could do this with a built-in app on your iPhone, a thir… [+2130 chars]"
224,"{'id': None, 'name': 'Gizmodo.com'}",Germain Lussier,Hasbro’s Next HasLab Is a Nearly 2 Foot Long Ecto-1 From Ghostbusters,This massive set has all the bells and whistles from the 1984 original and 1989 sequel.,https://gizmodo.com/hasbros-next-haslab-is-a-nearly-2-foot-long-ecto-1-from-ghostbusters-2000513901,https://gizmodo.com/app/uploads/2024/10/ghostbusters-haslab-nycc.jpg,2024-10-18T21:45:58Z,Hasbro’s awesome HasLab program just announced another release and this time around our first thought is “That’s a big Twinkie.” The toy company is once again back to the world of Ghostbusters and th… [+2214 chars]
225,"{'id': None, 'name': 'Gizmodo.com'}",Brittany Vincent,"Windows 11 Pro Slashed to Just $20, the Cheapest Option without Waiting for Black Friday","Isn't it high time you grabbed a new copy of Windows for your daily driver PC, especially with it being 89% off?",https://gizmodo.com/windows-11-pro-slashed-to-just-20-the-cheapest-option-without-waiting-for-black-friday-2000515147,https://gizmodo.com/app/uploads/2024/10/microsoft-windows-11-pro.jpg,2024-10-23T13:10:55Z,When’s the last time you had a freshly-installed OS on your PC? We won’t beat around the bush here. Windows can be super expensive. But it’s a necessity sometimes if you want your computer to run pro… [+2158 chars]
226,"{'id': None, 'name': 'Gizmodo.com'}",Joe Tilleli,Costco Yearly Membership for Only $20 Out of Pocket Includes a $45 Gift Card for Early Black Friday,StackSocial has Costco yearlong memberships starting at $65 that include a $45 digital gift card.,https://gizmodo.com/costco-yearly-membership-for-only-20-out-of-pocket-includes-a-45-gift-card-for-early-black-friday-2000517560,https://gizmodo.com/app/uploads/2024/10/costo1.jpg,2024-10-28T19:49:05Z,"The holiday shopping season is basically here. Have you put much thought into what you’re getting your family and friends this year? If you have not, maybe first start with a gift for yourself. You c… [+2207 chars]"
227,"{'id': None, 'name': 'Gizmodo.com'}",Joe Tilleli,Amazon Cuts Anker’s MagGo UFO Charger Price by 20% for the First Time Before Black Friday,Save 20% on the travel-sized Anker MagSafe Compatible MagGo UFO 3-in-1 charger over at Amazon for a limited time.,https://gizmodo.com/amazon-cuts-ankers-maggo-ufo-charger-price-by-20-for-the-first-time-before-black-friday-2000516712,https://gizmodo.com/app/uploads/2024/10/Anker3in1.jpg,2024-10-25T19:09:28Z,"We an inundated with devices that need to be plugged in every once in awhile. Our phones need to charge, our headphones need to charge, our watches you guessed it need to charge. This can result in c… [+2187 chars]"
228,"{'id': None, 'name': 'Gizmodo.com'}",Gizmodo Deals,"This 15-Inch Portable Monitor is Ideal For Gaming or Work, Now Just $59 on Amazon For Early Black Friday",Unlock your gaming and work potential.,https://gizmodo.com/this-15-inch-portable-monitor-is-ideal-for-gaming-or-work-now-just-59-on-amazon-for-early-black-friday-2000520050,https://gizmodo.com/app/uploads/2024/11/portable-monitor-15.jpg,2024-11-03T21:37:00Z,"A great 15-inch portable monitor is currently available on Amazon for an impressive price of $58 down from its original retail price of $89. With a standard listing price of $63, the additional 9% co… [+2369 chars]"
229,"{'id': None, 'name': 'Gizmodo.com'}",Tom Maxwell,Amazon Adds Gasoline and EV Charging Discounts to Prime,It's another benefit to keep you from canceling your membership.,https://gizmodo.com/amazon-adds-gasoline-and-ev-charging-discounts-to-prime-2000515529,https://gizmodo.com/app/uploads/2024/10/GettyImages-1661430512.jpg,2024-10-23T15:20:07Z,"Amazon Prime over the years has expanded to include a hodgepodge of benefits, and starting today members will begin receiving a new one: fuel discounts.
Starting with gasoline, Amazon says that Prim… [+1862 chars]"
230,"{'id': None, 'name': 'Gizmodo.com'}",Brittany Vincent,This Levoit Air Purifier for Less Than $40 Is Only Available on Prime Day,Stop inhaling all that filthy air for less than $40 with this can't-miss discount.,https://gizmodo.com/this-levoit-air-purifier-for-less-than-40-is-only-possible-in-prime-day-2000509465,https://gizmodo.com/app/uploads/2024/10/levoit-air-purifier.jpg,2024-10-08T22:32:35Z,"Have you ever stopped to think about the air quality inside your house? It might be a little more gross than you realize. Okay, a lot more gross. The air we breathe indoors is practically teeming wit… [+2159 chars]"
231,"{'id': None, 'name': 'Gizmodo.com'}",Gizmodo Deals,This Bose Headset is Affordable For Everyone Since it’s 43% Off For Prime Day,This Bose headset is among the finest headphones globally featuring active noise cancellation.,https://gizmodo.com/this-bose-headset-is-affordable-for-everyone-since-its-43-off-for-prime-day-2000508920,https://gizmodo.com/app/uploads/2024/10/headphones-bose.jpg,2024-10-08T11:17:50Z,"This Tuesday morning, Amazon has unleashed a great deal on the very popular Bose QuietComfort headphones which have plummeted to an astonishing $199 from their original $349 price tag. This massive 4… [+2356 chars]"
232,"{'id': None, 'name': 'Gizmodo.com'}",Brittany Vincent,Too Hot? Too Cold? This 36% Off Dyson Fan and Heater Combo Is a Thoughtful Prime Day Deal for Fall,"This Dyson's AM09 fan and heater goes for nearly $470, but this Prime Day sale can get you one for just $299.",https://gizmodo.com/too-hot-too-cold-this-36-off-dyson-fan-and-heater-combo-is-a-thoughtful-prime-day-deal-for-fall-2000508455,https://gizmodo.com/app/uploads/2024/10/Untitled-design-3.jpg,2024-10-07T18:37:43Z,"Are you one of those people who can never decide which temperature feels best? First you’re too hot, so you adjust the AC to cool you down. But then you’re too cold, so you need a blanket to warm up.… [+2036 chars]"
233,"{'id': None, 'name': 'Gizmodo.com'}",Mike Fazioli,This $100 Smartphone Is Cheaper Than iPhones and Smaller Than Your Credit Card,"The fun-sized NanoPhone is no toy. 4G connectivity, dual SIM support, and your favorite apps all fit in this tiny package.",https://gizmodo.com/this-100-smartphone-is-cheaper-than-iphones-and-smaller-than-your-credit-card-2000515023,https://gizmodo.com/app/uploads/2024/10/NanoPhone.jpg,2024-10-22T17:11:11Z,"If someone handed you a cellphone smaller than a credit card, you’d instantly assume it was either a toy or a gimmick phone that could barely perform even the most basic functions. The NanoPhone all … [+2187 chars]"
234,"{'id': None, 'name': 'Gizmodo.com'}",Joe Tilleli,"Headway Premium Lifetime Access for Just $45, Save Money and Time with this Best App",You can get #1 most downloaded book summary app for just $45 with coupon code,https://gizmodo.com/headway-premium-lifetime-access-for-just-45-save-money-and-time-with-this-best-app-2000518496,https://gizmodo.com/app/uploads/2024/10/Headway-.jpg,2024-10-30T18:43:44Z,"There’s just so much information out there waiting to be absorbed, it’s impossible to read it all. Our hunger for knowledge and curiosity can never be fully satiated. We’re all pretty busy, some of u… [+2301 chars]"
235,"{'id': None, 'name': 'Gizmodo.com'}",Brittany Vincent,"This Ninja Air Fryer Is Back Down to Its Lowest Price, So Grab One for Holiday Food Prep",Prep delicious meals quickly and easily with this all-in-one appliance Ninja Air Fryer (48% off).,https://gizmodo.com/this-ninja-air-fryer-is-back-down-to-its-lowest-price-so-grab-one-for-holiday-food-prep-2000518855,https://gizmodo.com/app/uploads/2024/10/ninja-air-fryer-1.jpg,2024-10-31T14:50:13Z,"Sometimes, you need to get dinner out on the tablet quickly and easily. There’s no time to swap between appliances and do this and that while you’re prepping food. You need something that can do the … [+2073 chars]"
236,"{'id': None, 'name': 'Yahoo Entertainment'}",,One of the world's best airlines is adding a flyer-favorite feature to its business class as premium competition heats up,,https://consent.yahoo.com/v2/collectConsent?sessionId=1_cc-session_0047130c-d4ab-4479-bf64-23a50d00e54d,,2024-11-04T20:21:12Z,"If you click 'Accept all', we and our partners, including 237 who are part of the IAB Transparency &amp; Consent Framework, will also store and/or access information on a device (in other words, use … [+678 chars]"
237,"{'id': None, 'name': 'Swizec.com'}",,It made me $500k but I think content is a bad business,Why I didn't become a full-time creator/educator,https://swizec.com/blog/it-made-me-500k-but-i-think-content-is-a-bad-business/,https://swizec.com/social-cards/it-made-me-dollar500k-but-i-think-content-is-a-bad-business.png,2024-10-12T17:16:57Z,"A friend asked ""Swiz, why do you even have a job?"" referring to my pretty successful sidebiz around books and courses for software engineers. I couldn't stop thinking about it so here we are.
The bu… [+10058 chars]"
238,"{'id': 'hacker-news', 'name': 'Hacker News'}",,"Hammer Looking for a Nail, AI Drone Looking for Business Case",Comments,https://news.ycombinator.com/item?id=41825473,,2024-10-13T05:41:34Z,"Ive fulfilled my duty to Roko's basilisk. I made an Aerial Intelligence system, and I call it Dispatcher. Jarvis on a drone, skynet, or compute token eater, its basically a drone you don't have to fl… [+1648 chars]"
239,"{'id': 'business-insider', 'name': 'Business Insider'}",Emily Stewart,The poisoned chalice of restaurant popularity,New research shows restaurants that won major awards like a Michelin star were more likely to close due to the pressure of high demand.,https://www.businessinsider.com/restaurants-awards-michelin-star-new-york-city-dining-rent-costs-2024-10,https://i.insider.com/6717df29a0a0cc14f22306ad?width=1200&format=jpeg,2024-10-23T09:56:01Z,"Valentin Tkach for Business Insider
Discovering a great restaurant is thrilling, especially before it really takes off. It's delightful to scope out a fresh place, realize the food is amazing, and t… [+8667 chars]"
240,"{'id': 'business-insider', 'name': 'Business Insider'}",Katherine Tangalakis-Lippert,Judge's ruling against Google in Epic Games case highlights a shift in antitrust law,A judge on Monday ruled against Google in its battle against Epic Games. Experts told BI the ruling shows how antitrust law has turned on Big Tech.,https://www.businessinsider.com/google-epic-games-case-antitrust-law-2024-10,https://i.insider.com/6705a9033f2165d716df6600?width=1200&format=jpeg,2024-10-09T09:00:02Z,"Google has faced a recent series of antitrust rulings that could cost the tech giant billions.ALAIN JOCARD/AFP via Getty Images
<ul><li>A California judge on Monday ruled Google must open up Android… [+5105 chars]"
241,"{'id': 'business-insider', 'name': 'Business Insider'}",Kimanzi Constable,I take quiet vacations as often as I can. My employers have no idea where I am thanks to VPN tricks and my meticulous calendar.,Benjamin Fields is a Ph.D. student and a high school math teacher in Oklahoma. He takes multiple international trips per year without telling anyone.,https://www.businessinsider.com/quiet-vacation-jobs-teacher-employers-have-no-idea-2024-11,https://i.insider.com/6723d5b0a0a0cc14f2255bd2?width=1200&format=jpeg,2024-11-01T09:05:02Z,"Benjamin Fields is a Ph.D. student and a high school math teacher.Courtesy of Benjamin Fields
<ul><li>Benjamin Fields balances teaching jobs while traveling globally without his employers knowing.</… [+5658 chars]"
242,"{'id': 'business-insider', 'name': 'Business Insider'}",Dominick Reuter,Bed Bath & Beyond owner to lay off 20% of its workforce,"Beyond, Inc., formerly known as Overstock, said in a regulatory filing that it will cut one-fifth of its workforce to save $20 million a year.",https://www.businessinsider.com/bed-bath-and-beyond-owner-layoffs-2024-10,https://i.insider.com/671a7c3201ea6d83dee3c9c7?width=1200&format=jpeg,2024-10-24T18:29:22Z,"Bed Bath & Beyond is online-only after the brand was sold last year.SOPA Images/Getty Images
<ul><li>Bed Bath & Beyond's owner said in a regulatory filing that it will cut one-fifth of its workforce… [+2374 chars]"
243,"{'id': 'business-insider', 'name': 'Business Insider'}",Kevin Reilly,"How millionaire bankers actually work, according to a former trader","Gary Stevenson, the author of ""The Trading Game,"" spent his early 20s trading trillions.",https://www.businessinsider.com/how-millionaire-bankers-actually-work-according-to-former-trader-2024-10,https://i.insider.com/6717ec609b3250dbbce937eb?width=1189&format=jpeg,2024-10-22T18:29:51Z,"Gary Stevenson, the author of ""The Trading Game,"" spent his early 20s trading trillions of dollars for Citibank in London and Tokyo.He says he won the job playing a card game. While some of his colle… [+616 chars]"
244,"{'id': 'business-insider', 'name': 'Business Insider'}",Nora Redmond,Europe's richest person is about to buy a soccer club with Paris FC deal,LVMH's expansion into sports continues as Bernard Arnault's family plans a 55% stake in Paris FC.,https://www.businessinsider.com/lvmh-bernard-arnault-billionaire-to-buy-paris-fc-football-club-2024-10,https://i.insider.com/6707b01f3f2165d716dfc333?width=1200&format=jpeg,2024-10-10T10:48:04Z,"Barnard Arnault's family is poised to acquire a 55% majority stake in French football club Paris FC.AP Photo/Michel Euler, Pool
<ul><li>Bernard Arnault's family is set to become a majority sharehold… [+2003 chars]"
245,"{'id': 'business-insider', 'name': 'Business Insider'}",Lauren Edmonds,"A couple took 31 trips to Orlando and vacationed at Walt Disney World using government funds, prosecutors say","An Army contractor got his girlfriend hired for a ""no-show job."" They then took vacations together using government funds, federal prosecutors say.",https://www.businessinsider.com/army-contractor-fraud-vacation-disney-world-government-funds-doj-says-2024-10,https://i.insider.com/67014d79a7031864927fb884?width=1200&format=jpeg,2024-10-06T18:02:41Z,"A view of Main Street at Disney World in Orlando, Florida.Joseph Prezioso/Anadolu Agency via Getty Images
<ul><li>An Army contractor and his girlfriend used government funds for ""numerous"" personal … [+2224 chars]"
246,"{'id': 'business-insider', 'name': 'Business Insider'}",Anneta Konstantinides,"I tried a $1,000 steak at the Fontainebleau Las Vegas. It was the ultimate Sin City dining experience.","The Beef Case at Papi Steak, the buzzy restaurant at the Fontainebleau Las Vegas, is delivered in a diamond briefcase and comes with its own show.",https://www.businessinsider.com/papi-steak-beef-case-fontainebleau-las-vegas-review-2024-11,https://i.insider.com/6723ae8a9b3250dbbceb732d?width=1184&format=jpeg,2024-11-01T10:32:02Z,"The $1,000 Beef Case at Papi Steak, the celebrity-loved restaurant at Fontainebleau Las Vegas.Anneta Konstantinides/Business Insider
<ul><li>I tried the $1,000 Beef Case at Papi Steak, the celebrity… [+6593 chars]"
247,"{'id': None, 'name': 'BBC News'}",,Smuggler reveals operation to help Vietnamese reach UK,"Man claims to the BBC that he has helped 1,000 people cross the Channel in his years working in the smuggling industry.",https://www.bbc.com/news/articles/ce3yzq6px3eo,https://ichef.bbci.co.uk/news/1024/branded_news/6ae8/live/bc0321f0-92e6-11ef-89ae-5575c76d98e6.jpg,2024-10-28T06:03:48Z,"A prolific Vietnamese people smuggler, who entered the UK illegally this year in a small boat, has told the BBC he forges visa documents for other Vietnamese who plan to make the same crossing.
The … [+15298 chars]"
248,"{'id': 'business-insider', 'name': 'Business Insider'}",Joey Hadden,"Step inside Jackson Hole, Wyoming, where the ultra-rich live and vacation","Jackson Hole, Wyoming, is a luxury haven for the wealthy. Low taxes, remote estates, and mountain landscapes draw billionaires and celebrities.",https://www.businessinsider.com/jackson-hole-wyoming-where-billionaires-live-vacation-2024-10,https://i.insider.com/670d7c0d6ac7b701e7caedcc?width=1200&format=jpeg,2024-10-19T09:04:02Z,"Business Insider's reporter went to Jackson Hole, Wyoming, to see how some of America's wealthiest live and vacation.Joey Hadden/Business Insider
<ul><li>Jackson Hole, Wyoming, is a luxury enclave f… [+8156 chars]"
249,"{'id': 'business-insider', 'name': 'Business Insider'}",Jyoti Mann,"Geoffrey Hinton, the 'godfather of AI' who warned of its existential risk, awarded Nobel Prize for Physics",Geoffrey Hinton and John J. Hopfield win the 2024 Nobel Prize in Physics for  machine learning inventions with artificial neural networks.,https://www.businessinsider.com/geoffrey-hinton-godfather-ai-nobel-prize-physics-john-hopfield-2024-10,https://i.insider.com/67050a7a3f2165d716df23f8?width=1200&format=jpeg,2024-10-08T10:49:46Z,"Computer scientist Geoffrey Hinton has been referred to as the ""Godfather of AI.""Noah Berger/Associated Press
<ul><li>Geoffrey Hinton and John J. Hopfield have been awarded the 2024 Nobel Prize in P… [+1675 chars]"
250,"{'id': 'business-insider', 'name': 'Business Insider'}","Erica Star Domena,Tamara Lindstrom",Deadly Hurricane Milton halts life for millions of Floridians as it ravages the state,"Hurricane Milton hit Florida with 120 mph winds and over 100 tornadoes,  leaving 11 million people at risk of flash floods.",https://www.businessinsider.com/milton-florida-hurricane-flood-tornado-wind-death-2024-10,https://i.insider.com/67082b886ac7b701e7ca3c9d?width=1200&format=jpeg,2024-10-10T21:13:57Z,"Hurricane Milton hit Florida with 120 mph winds and over 100 tornadoes, leaving 11 million people at risk of flash floods.Read the original article on Business Insider"
251,"{'id': 'business-insider', 'name': 'Business Insider'}","Erica Star Domena,Selima Hussain",Israeli airstrike kills 18 in attack near Lebanon's largest public hospital,"An Israeli airstrike hit Lebanon October 21 near the country's largest hospital, killing at least 18 people and injuring 60 others.",https://www.businessinsider.com/israeli-airstrike-kills-18-attack-near-lebanons-largest-public-hospital-2024-10,https://i.insider.com/6717f9bc9b3250dbbce93da7?width=1200&format=jpeg,2024-10-22T19:41:59Z,"An Israeli airstrike hit Lebanon on October 21 near the country's largest hospital, killing at least 18 people and injuring 60 others.Read the original article on Business Insider"
252,"{'id': 'business-insider', 'name': 'Business Insider'}",Lian Kit Wee,X Is back up and running in Brazil after it caved and paid a fine — because there are some battles Elon Musk can't win,X paid a fine and complied with the country's Supreme Court orders over content moderation and legal representation.,https://www.businessinsider.com/x-is-reinstated-elon-musk-brazil-twitter-2024-10,https://i.insider.com/6705fe01a703186492807165?width=1200&format=jpeg,2024-10-09T06:57:56Z,"Brazil's Supreme Court will reinstate X for millions of users in the country after the platform paid a fine and complied with the court's demands.Jaap Arriens/Getty Images
<ul><li>X can operate in B… [+3193 chars]"
253,"{'id': 'business-insider', 'name': 'Business Insider'}",Taylor Rains,"Skiplagged, the money-saving website that airlines hate, says it's not going anywhere after losing a $9.4 million lawsuit from American","Skiplagged's CEO told BI the travel website will still sell money-saving ""hidden-city"" fares, no matter how much airlines hate it.",https://www.businessinsider.com/skiplagged-will-continue-selling-hidden-ticket-throwaway-fares-american-lawsuit-2024-10,https://i.insider.com/6717bf1001ea6d83dee32176?width=1200&format=jpeg,2024-10-22T21:11:28Z,"American Airlines sued Skiplagged for damages of ""hidden-city"" ticketing.Scott Olson/Staff
<ul><li>Skiplagged will still offer hidden-city fares despite a $9.4 million ruling for American Airlines.<… [+2980 chars]"
254,"{'id': 'business-insider', 'name': 'Business Insider'}",Dan Whateley,TikTok's next big move: Helping creators launch product lines by connecting them with suppliers,"TikTok has begun connecting manufacturers directly with creators to make custom goods to sell on Shop, as the company looks to drive up sales.",https://www.businessinsider.com/tiktok-is-matching-creators-with-manufacturers-to-make-custom-products-2024-10,https://i.insider.com/6711364b01ea6d83dee1e018?width=1200&format=jpeg,2024-10-17T21:51:10Z,"Shopping is a major focus at TikTok as the company looks to compete in social commerce.Craig Barritt/Getty Images for TikTok.
<ul><li>TikTok wants to help creators sell their own custom products.</l… [+3597 chars]"
255,"{'id': 'business-insider', 'name': 'Business Insider'}",Erin Liam,"Hoda Kotb says that after adopting her daughters, she questioned whether she deserved them","It took some time for her to realize that she deserved her kids, said Kotb, who became a mother in her 50s.",https://www.businessinsider.com/hoda-kotb-worried-about-deserving-kids-parental-imposter-syndrome-adoption-2024-10,https://i.insider.com/6720634fa0a0cc14f2247fbd?width=976&format=jpeg,2024-10-29T05:49:00Z,"Hoda Kotb says it took some time for her to realize that she deserved her kids.Nathan Congleton/NBC via Today
<ul><li>Hoda Kotb, 60, said she used to think that she didn't deserve her kids.</li><li>… [+3164 chars]"
256,"{'id': 'business-insider', 'name': 'Business Insider'}",Lara O'Reilly,Gaming giant Take-Two is in talks to sell its Chartboost adtech division,Take-Two picked up Chartboost through its $12.7 billion acquisition of mobile gaming company Zynga in 2022.,https://www.businessinsider.com/take-two-in-talks-sell-chartboost-adtech-division-2024-10,https://i.insider.com/672211179b3250dbbceb07a3?width=1200&format=jpeg,2024-10-30T18:40:00Z,"Take-Two, which owns franchises like ""Red Dead Redemption,"" is looking to offload its adtech asset Chartboost.Business Wire/Take-Two Interactive Software, Inc.
<ul><li>Take-Two Interactive is in tal… [+3948 chars]"
257,"{'id': 'business-insider', 'name': 'Business Insider'}",Ayomikun Adekaiyero,"Simran Bhogal, the catfisher behind Netflix's 'Sweet Bobby,' has managed to completely scrub herself from the internet","Netflix's ""Sweet Bobby"" follows an eight-year catfishing story. Here's what we know about the catfisher, Simran Bhogal.",https://www.businessinsider.com/where-is-simran-bhogal-now-sweet-bobby,https://i.insider.com/67164377a0a0cc14f2228295?width=1200&format=jpeg,2024-10-21T19:11:38Z,"An actor portrays Simran Bhogal in ""Sweet Bobby: My Catfish Nightmare.""Netflix
<ul><li>Kirat Assi shares her story of being catfished for eight years in Netflix's ""Sweet Bobby: My Catfish Nightmare.… [+3837 chars]"
