,source,author,title,description,url,urlToImage,publishedAt,content
0,"{'id': None, 'name': 'Yahoo Entertainment'}",Daniel Cooper,Star Trek: Lower Decks bows out on business as usual,"The following article discusses the fifth season of Star Trek: Lower Decks and older Treks.
There’s no such thing as “dead” in Star Trek, the sprawling, perpetual opus that has thrived in spite of itself for almost sixty years. What started as a cornball spac…",https://consent.yahoo.com/v2/collectConsent?sessionId=1_cc-session_ea661c3d-6ab7-4553-a94d-5c4f75f013db,,2024-10-19T20:00:17Z,"If you click 'Accept all', we and our partners, including 238 who are part of the IAB Transparency &amp; Consent Framework, will also store and/or access information on a device (in other words, use … [+678 chars]"
1,"{'id': None, 'name': '[Removed]'}",,[Removed],[Removed],https://removed.com,,2024-10-16T22:39:13Z,[Removed]
2,"{'id': None, 'name': 'Gizmodo.com'}",Cheryl Eddy,Here’s Wassup With That Scary Movie Reboot,"After a tease earlier this year, it's official: the Wayans Brothers are back in the horror parody business.",https://gizmodo.com/scary-movie-reboot-wayans-brothers-2000518013,https://gizmodo.com/app/uploads/2024/10/scarymovie.jpg,2024-10-29T17:10:54Z,"A few days before Halloween feels like the perfect moment for this update: that new Scary Movie entry, teased at CinemaCon earlier this year, is officially moving full steam ahead. Even better, the W… [+2698 chars]"
3,"{'id': None, 'name': 'BBC News'}",,"I was a desperate mum, says woman whose search for eczema cure led to award-winning business","Shalom Lloyd says starting her business on her kitchen table was ""a fluke"".",https://www.bbc.com/news/articles/cx2y4p2pvjyo,https://ichef.bbci.co.uk/news/1024/branded_news/1ff4/live/f8fe56b0-87ab-11ef-b0bd-ed1c890dbbf6.jpg,2024-10-13T05:22:12Z,"Joshua Lloyd was born with severe eczema that he would scratch, his mother Shalom said
When Shalom Lloyd's twins Joshua and Amara were born in March 2014, her son had severe eczema that left him ble… [+3479 chars]"
4,"{'id': None, 'name': 'BBC News'}",,"Stolen cheddar might be heading to Russia, supplier tells BBC","A supplier of cheese stolen in a £300,000 scam said the business was based on trust.",https://www.bbc.com/news/articles/c5ygw9ye90po,https://ichef.bbci.co.uk/news/1024/branded_news/e308/live/394e0570-950e-11ef-875b-053ddaf3f72b.png,2024-10-28T10:21:32Z,"The supplier of Hafod cheddar - produced near Lampeter, western Wales - said the theft should be a ""wake-up call"" 
Cheddar stolen from London cheese specialist Neals Yard Dairy may have been shipped… [+2490 chars]"
5,"{'id': None, 'name': 'Gizmodo.com'}",Matthew Gault,"For the Love of God, Stop Making Inscrutable Doomsday Clocks","A business school is using AI doomerism, money from Saudi Arabia, and a dusty Cold War metaphor to get people hyped about AI’s future.",https://gizmodo.com/for-the-love-of-god-stop-making-inscrutable-doomsday-clocks-2000512111,https://gizmodo.com/app/uploads/2024/10/doomsday_clock.jpg,2024-10-15T18:00:03Z,"A Saudi-backed business school in Switzerland has launched a Doomsday Clock to warn the world about the harms of uncontrolled artificial general intelligence, what it calls a god-like AI. Imagine if … [+5139 chars]"
6,"{'id': None, 'name': 'BBC News'}",,The Papers: 'Right time to buy into Britain' and university expenses,"The papers lead on a variety of stories, including a business summit in the UK on Monday.",https://www.bbc.com/news/articles/c5y3zv787d5o,https://ichef.bbci.co.uk/news/1024/branded_news/cd1d/live/af8fe460-89ba-11ef-b6b0-c9af5f7f16e4.jpg,2024-10-14T00:17:17Z,"Several papers highlight Israel's potential next move against Iran, with widespread speculation its oil infrastructure could be targeted."
7,"{'id': None, 'name': 'Gizmodo.com'}",Tom Maxwell,American Airlines Wins $9.4 Million From ‘Skiplagged’ Site That Exploits Airlines’ Business Model,"Airlines use lots of tricky games to price their fares. Skiplagged gives agency back to the customer, and American didn't like that.",https://gizmodo.com/american-airlines-wins-9-4-million-from-skiplagged-site-that-exploits-airlines-business-model-2000514406,https://gizmodo.com/app/uploads/2024/10/GettyImages-1940871559.jpg,2024-10-21T15:50:37Z,"A Texas federal jury has awarded American Airlines a whopping $9.4 million in a lawsuit filed against Skiplagged.com, a website that helps travelers get cheaper flights by booking flights with a conn… [+3889 chars]"
8,"{'id': None, 'name': 'Gizmodo.com'}",Lucas Ropek,"Nobody Can Rent Twister, the Last DVD Trapped in Redbox’s Dead Video Business",Hardware nerds just want to see Bill Paxton and Helen Hunt outrun a tornado. Why isn't that possible?,https://gizmodo.com/nobody-can-rent-twister-the-last-dvd-trapped-in-redboxs-dead-video-business-2000516681,https://gizmodo.com/app/uploads/2024/10/A-person-renting-a-movie-at-a-Redbox-dispenser.jpg,2024-10-25T20:30:22Z,"Though Redbox, the DVD vending machine company, is officially dead, the company’s disc-dispensing kiosks are still strewn all over America. The machines still work and there are still hundreds of DVD… [+2411 chars]"
9,"{'id': None, 'name': 'Gizmodo.com'}",Matthew Gault,U.S. Government Report Warns That a Dirty Bomb Could Be Bad for Business,A government watchdog has accused America’s nuclear commission of not thinking enough about the economic consequences of radiological terrorism.,https://gizmodo.com/u-s-government-report-warns-that-a-dirty-bomb-could-be-bad-for-business-2000509348,https://gizmodo.com/app/uploads/2024/10/NuclearPowerPlant.jpg,2024-10-08T18:45:47Z,"A U.S. government watchdog group is worried that one of Washingtons nuclear agencies isnt doing enough to study and prevent the economic impact of a nuclear dirty bomb.
The September 30th report com… [+4050 chars]"
10,"{'id': None, 'name': 'BBC News'}",,Meet the couple with 900 sheep but no farm,Sam and Samantha Edwards run a successful livestock business but do not have a farm tenancy.,https://www.bbc.com/news/articles/c0kjkev241mo,https://ichef.bbci.co.uk/news/1024/branded_news/f75b/live/1189c570-9080-11ef-afd0-8dff7afbffb4.png,2024-10-27T07:11:10Z,"Sam and Samantha Edwards dream of having their own farm tenancy
In 2020, Sam and Samantha Edwards embarked on a hobby involving a handful of ewes in pony paddocks near their home in west Dorset.
No… [+3003 chars]"
11,"{'id': None, 'name': 'Gizmodo.com'}",Todd Feathers,DOJ Reveals Its Plan for Breaking Up Google’s Search Monopoly,The agency said in a court filing that it is considering remedies ranging from forcing Google to split off parts of its business to requiring the company to share key data and details about its search algorithms with competitors.,https://gizmodo.com/doj-reveals-its-plan-for-breaking-up-googles-search-monopoly-2000509815,https://gizmodo.com/app/uploads/2024/10/Google-antitrust-doj.jpg,2024-10-09T15:30:31Z,The Department of Justice has laid out its broad-strokes plan for ending Googles monopoly over internet search after winning its antitrust case against the company in August. The sweeping changes cou… [+2671 chars]
12,"{'id': None, 'name': 'BBC News'}",,"No tax rises in payslips for 'working people', vows minister","Bridget Phillipson refused to say if a small business owner was a ""working person"" in an interview with the BBC, ahead of Wednesday's Budget.",https://www.bbc.com/news/articles/c789915n5elo,https://ichef.bbci.co.uk/news/1024/branded_news/e5a8/live/464c4f50-9452-11ef-9357-afc2b724fb78.jpg,2024-10-27T11:17:13Z,"Education Secretary Bridget Phillipson has said ""working people"" would not see higher taxes on their payslips following Wednesday's Budget.
During the election, Labour promised not to increase taxes… [+2334 chars]"
13,"{'id': 'business-insider', 'name': 'Business Insider'}",Alice Tecotzky,Arthur Blank joins 'Business Leaders for Harris' as his former business partner funnels money to Trump,"Blank is joining an initiative to woo more conservative, business-minded voters. Mark Cuban and Reid Hoffman are among industry titans also involved.",https://www.businessinsider.com/arthur-blank-joins-business-leaders-for-harris-cuban-hoffman-2024-10,https://i.insider.com/5f49491960bf1f0028079416?width=1024&format=jpeg,2024-10-25T19:27:52Z,"Blank joins Mark Cuban, Reid Hoffman, and other business titans in their effort to woo more conservative voters.Jonathan Bachman/Getty Images
<ul><li>Home Depot cofounder and billionaire Arthur Blan… [+2775 chars]"
14,"{'id': None, 'name': 'Slashdot.org'}",BeauHD,Boeing Explores Sale of Space Business,"According to the Wall Street Journal, Boeing is weighing the sale of its space division. ""The plans, which are reportedly at an early stage, could involve Boeing offloading the Starliner spacecraft and its projects supporting the International Space Station,""…",https://science.slashdot.org/story/24/10/26/0027249/boeing-explores-sale-of-space-business,https://a.fsdn.com/sd/topics/business_64.png,2024-10-26T07:00:00Z,"Boeing is facing a series of predicaments, including a fraud charge over 737 Max plane crashes and Starliner issues that left two astronauts at the ISS for months. Just this week, a Boeing-made satel… [+758 chars]"
15,"{'id': None, 'name': 'Yahoo Entertainment'}",Igor Bonifacic,Dropbox is laying off 20 percent of its workforce,"For the second time in less than two years, Dropbox is laying off a substantial portion of its workforce. In a blog post penned by CEO Drew Houston, the company said it would cut its global headcount by 20 percent or 528 employees. 
Dropbox will provide impac…",https://consent.yahoo.com/v2/collectConsent?sessionId=1_cc-session_044fc9fd-e34a-4f4f-898d-bf58072b4260,,2024-10-30T15:10:23Z,"If you click 'Accept all', we and our partners, including 237 who are part of the IAB Transparency &amp; Consent Framework, will also store and/or access information on a device (in other words, use … [+678 chars]"
16,"{'id': 'business-insider', 'name': 'Business Insider'}",Alex Nicoll,Inside Blackstone's growing 'credit juggernaut',"Credit is now Blackstone's largest business by assets. COO Jon Gray explains why it's ""very early days"" for the burgeoning lending business.",https://www.businessinsider.com/blackstone-third-quarter-earnings-private-credit-insurance-unit-aum-2024-10,https://i.insider.com/6699546949138fa6f6e38ace?width=1200&format=jpeg,2024-10-17T18:53:01Z,"Jon Gray, President and COO of Blackstone, poses for a portrait at the Blackstone Group headquarters in New York City, U.S., January 18, 2023.Jeenah Moon/Reuters
<ul><li>Private lending is now Black… [+5847 chars]"
17,"{'id': None, 'name': '[Removed]'}",,[Removed],[Removed],https://removed.com,,2024-10-28T20:38:07Z,[Removed]
18,"{'id': None, 'name': 'Android Central'}",tips@androidcentral.com (Nickolas Diaz),NotebookLM update lets you 'guide' its AI and listen while you work,Google highlighted two new features for NotebookLM and introduced a Business variant of the app.,https://www.androidcentral.com/apps-software/notebooklm-guide-ai-hosts-business-pilot-program,https://cdn.mos.cms.futurecdn.net/zzPTyYHBTjqpoen3vuSttM-1200-80.jpg,2024-10-17T20:20:33Z,"What you need to know
<ul><li>Google detailed two new features arriving for NotebookLM, beginning with a ""customize"" button to guide the AI hosts in Audio Overviews.</li><li>The other feature lets u… [+2776 chars]"
19,"{'id': None, 'name': 'Yahoo Entertainment'}",Anna Washenko,OpenAI and Microsoft are funding $10 million in grants for AI-powered journalism,"OpenAI and Microsoft are funding projects to bring more AI tools into the newsroom. The duo will give grants of up to $10 million to Chicago Public Media, the Minnesota Star Tribune, Newsday (in Long Island, NY), The Philadelphia Inquirer and The Seattle Time…",https://consent.yahoo.com/v2/collectConsent?sessionId=1_cc-session_a4f5a67c-45e7-4197-be4b-8ec7e70c5bc4,,2024-10-22T19:30:42Z,"If you click 'Accept all', we and our partners, including 237 who are part of the IAB Transparency &amp; Consent Framework, will also store and/or access information on a device (in other words, use … [+678 chars]"
20,"{'id': 'business-insider', 'name': 'Business Insider'}",Dan DeFrancesco,Space travel comes with big dreams and bigger business,NASA's Europa Clipper launched on Monday with the help of a SpaceX Falcon Heavy rocket.,https://www.businessinsider.com/the-final-frontier-life-on-europa-nasa-launch-jupiter-moon-2024-10,https://i.insider.com/670e49333f2165d716e0c700?width=1200&format=jpeg,2024-10-15T11:20:21Z,"NASA/JPL-Caltech/SETI Institute
<ul><li>This excerpt originally appeared in the Insider Today newsletter.</li><li>You can sign up for Business Insider's daily newsletter here.</li></ul>Is there life… [+2450 chars]"
21,"{'id': None, 'name': 'Harvard Business Review'}",,Should Your Business Take a Stand on Societal Issues?,Former Best Buy chairman and CEO Hubert Joly discusses his leadership case study.,https://hbr.org/podcast/2024/10/should-your-business-take-a-stand-on-societal-issues,https://hbr.org/resources/images/article_assets/2023/05/wide-hbr-on-leadership.png,2024-10-30T13:16:35Z,"HANNAH BATES: Welcome to HBR on Leadership, case studies and conversations with the world’s top business and management experts, hand-selected to help you unlock the best in those around you.
Here’s… [+27946 chars]"
22,"{'id': 'business-insider', 'name': 'Business Insider'}",Mikhaila Friel,I'm an American who has visited Scotland around a dozen times. Here are the 3 biggest mistakes I see tourists make.,"Helene Sula, an American travel blogger, told Business Insider why it's important to venture beyond Edinburgh.",https://www.businessinsider.com/american-visited-scotland-biggest-tourist-mistakes-cities-highlands-weather-2024-10,https://i.insider.com/66fe56e39e0c5c2eeeea3feb?width=1200&format=jpeg,2024-10-13T17:13:35Z,"Helene Sula is a travel blogger from Texas.Helene Sula
<ul><li>Helene Sula is a US travel blogger who has visited Scotland around a dozen times.</li><li>Sula said people needed to explore beyond Edi… [+3354 chars]"
23,"{'id': 'business-insider', 'name': 'Business Insider'}",Catherine Boudreau,"The SBA can't help business owners hit by Helene, Milton until Congress comes back post-election","The Small Business Administration can't make disaster loans to businesses, homeowners until Congress approves more funding.",https://www.businessinsider.com/small-business-disaster-loan-program-is-out-of-funds-2024-10,https://i.insider.com/67107e406ac7b701e7ccb9e2?width=1024&format=jpeg,2024-10-17T11:02:01Z,"Hurricane Helene caused record flooding and damage on September 28, 2024 in Asheville, North Carolina.Melissa Sue Gerrits/Getty Images
<ul><li>The Small Business Administration ran out of funding fo… [+3903 chars]"
24,"{'id': None, 'name': 'Gizmodo.com'}",Gizmodo Deals,"Microsoft Office 2024 is Available Now, And Here’s How to Save 20% on it With a Late Prime Day Deal","Microsoft Office 2024 is now available, and you can take advantage of a fantastic late Prime Day deal to save 20% on your purchase.",https://gizmodo.com/microsoft-office-2024-is-available-now-and-heres-how-to-save-20-on-it-with-a-late-prime-day-deal-2000511723,https://gizmodo.com/app/uploads/2024/10/microsoft-office-2024-business.jpg,2024-10-14T13:47:06Z,"Microsoft has just released Office 2024 Home &amp; Business a few days ago, and savvy shoppers can already take advantage of a great deal on StackSocial as part of a late Prime Day offer. This latest… [+2573 chars]"
25,"{'id': 'business-insider', 'name': 'Business Insider'}",Polly Thompson,Big 4 giant EY delayed start dates for some new hires for the 2nd consecutive year as business slows,"EY said the deferred start dates for some new staff reflected ""the current M&A environment and our business needs.""",https://www.businessinsider.com/ey-graduate-hires-start-dates-delayed-slowdown-strategy-consulting-2024-10,https://i.insider.com/670cd2de6ac7b701e7cac3a3?width=1200&format=jpeg,2024-10-14T15:20:36Z,"EY has told some new hires that they'll be joining the company later than planned. Jack Taylor/Stringer/Getty Images
<ul><li>EY has delayed start dates for some of its new hires for a second consecu… [+2689 chars]"
26,"{'id': 'business-insider', 'name': 'Business Insider'}",Joey Hadden,"I booked the cheapest accommodation I could find in Jackson Hole. For $150 a night, I got a bunk in a high-end hostel.","Business Insider took a trip to Jackson Hole, Wyoming, and booked one night at Cache House, an upscale hostel.",https://www.businessinsider.com/i-stayed-in-luxury-hostel-jackson-hole-was-worth-it-2024-10,https://i.insider.com/67114258fd8ede6c99e37751?width=1200&format=jpeg,2024-10-26T09:32:02Z,"The cheapest accommodation Business Insider's reporter could find in Jackson Hole, Wyoming, was a queen-sized bunk in a high-end hostel for $150. Joey Hadden/Business Insider
<ul><li>I stayed in a h… [+7159 chars]"
27,"{'id': 'business-insider', 'name': 'Business Insider'}",Joey Hadden,I'm a New Yorker who visited Jackson Hole for the first time. 8 things surprised me.,"Business Insider's reporter was surprised by Jackson Hole's luxury airport, spread-out housing, and nature-inspired interior design.",https://www.businessinsider.com/surprising-things-new-yorker-found-visiting-jackson-hole-wyoming-2024-10,https://i.insider.com/6723dd8b9b3250dbbceb8c1b?width=1200&format=jpeg,2024-11-02T10:43:01Z,"Business Insider's reporter visited Jackson Hole, Wyoming, for the first time and encountered a few surprises.Joey Hadden/Business Insider
<ul><li>Jackson Hole, Wyoming, is a billionaire hot spot ne… [+10294 chars]"
28,"{'id': 'business-insider', 'name': 'Business Insider'}",mnoyen@insider.com (Maria Noyen),"Sorry Mom and Dad, Gen Z is calling the shots on the family vacation now","Gen Zers aren't just tagging along on their parent's pricey trips; they are calling the shots, luxury travel agents told Business Insider.",https://www.businessinsider.com/gen-z-increasingly-dictating-family-vacation-itinerary-2024-10,https://i.insider.com/671653e4a0a0cc14f22283f6?width=1200&format=jpeg,2024-10-27T16:01:01Z,"Gen Z is growing up. They're high school students, college seniors, graduates, and a burgeoning cohort in the US workforce.
But as much as they may be dabbling with ""adulting,"" one part of childhood… [+3736 chars]"
29,"{'id': 'business-insider', 'name': 'Business Insider'}",Lindsay Dodgson,I felt out of my depth with my multi-million-dollar business. Sharing my struggles on TikTok helped save me.,"Aimee Smale started her fashion brand, Odd Muse, four years ago, but struggled with how quickly the business grew.",https://www.businessinsider.com/tiktok-helped-me-when-feeling-overwhelmed-about-running-my-business-2024-10,https://i.insider.com/67294a25192f5258985604b7?width=1066&format=jpeg,2024-11-06T10:37:23Z,"Amy Smale, the founder and CEO of Odd Muse.Amy Smale/Odd Muse
<ul><li>Aimee Smale started her fashion brand Odd Muse four years ago, and it is now a $20 million business.</li><li>On TikTok, she said… [+4168 chars]"
30,"{'id': 'business-insider', 'name': 'Business Insider'}",Talia Lakritz,"I toured the Concorde, a discontinued supersonic commercial jet flown by celebrities and royals. Take a look inside.","As the first and only supersonic commercial jetliner, Concorde was popular with royals, celebrities, and business executives.",https://www.businessinsider.com/concorde-supersonic-plane-tour-photos-2024-10,https://i.insider.com/670e93563f2165d716e0fedb?width=1000&format=jpeg,2024-10-15T18:26:52Z,"The Concorde at the Intrepid Museum.R Ikeda/Shutterstock
<ul><li>Concorde, the first and only supersonic commercial jetliner, operated from 1976 to 2003.</li><li>Flown by royals, celebrities, and ex… [+7995 chars]"
31,"{'id': 'business-insider', 'name': 'Business Insider'}",Samantha Stokes,Business Insider is seeking nominations for the 2024 rising stars of venture capital,Business Insider is putting together a list of the best up-and-coming venture capitalists of 2024.,https://www.businessinsider.com/business-insiders-2024-rising-stars-of-venture-capital-nominations-2024-10,https://i.insider.com/656562c0fd6200867dd0096a?width=1200&format=jpeg,2024-10-09T13:00:02Z,"From left: 2023 VC Rising Stars Vivien Ho, Toby Koker, Adina Tecklu, and Alysaa Co.Vivien Ho/Toby Koker/Adina Tecklu/Alysaa Co
<ul><li>Insider is putting together a list of the best up-and-coming ve… [+1044 chars]"
32,"{'id': 'business-insider', 'name': 'Business Insider'}",Hilary Brueck,I went to a longevity conference for the ultra-rich. Here's how they're planning to cheat death.,"Business Insider got a peek into the 2024 Longevity Investors Conference, where billionaires chatted with scientists and entrepreneurs.",https://www.businessinsider.com/longevity-investments-ultra-rich-are-making-supplements-devices-2024-10,https://i.insider.com/670838d43f2165d716e00aaf?width=1099&format=jpeg,2024-10-11T16:05:05Z,"Moderator Martina Fuchs trying out some of the new tech on display at the Longevity Investors Conference in Gstaad, Switzerland.Longevity Investors Conference / David Biedert
<ul><li>Longevity inves… [+7127 chars]"
33,"{'id': 'business-insider', 'name': 'Business Insider'}",Madeline Berg,Sean Combs' once-lucrative business empire is drying up. Here's where it stands.,"""There is no way a brand is touching Diddy — probably forever,"" one entertainment expert told Business Insider.",https://www.businessinsider.com/sean-combs-diddy-business-income-dried-up-ciroc-music-deleon-2024-10,https://i.insider.com/6704863da70318649280177b?width=1200&format=jpeg,2024-10-09T09:27:02Z,"Sean Combs' income streams have taken loss after loss since allegations of sexual abuse came to light last year.MEGA/GC Images
<ul><li>Sean Combs was once one of the world's top-earning entertainers… [+8906 chars]"
34,"{'id': 'business-insider', 'name': 'Business Insider'}",Kathleen Elkins,"I started an e-commerce business with $5,000 upfront after writing about financially independent Amazon sellers. Here's how I doubled my budget.",How hard is it really to launch an e-commerce business? I decided to find out for myself.,https://www.businessinsider.com/launching-an-e-commerce-business-step-one-finding-business-partner-2024-10,https://i.insider.com/66fd69225ccfc192a552943a?width=1140&format=jpeg,2024-10-23T13:13:44Z,"The author is a personal finance reporter based in LA who covers lucrative side hustles, including e-commerce.Courtesy of Kathleen Elkins
<ul><li>Inspired by successful e-commerce entrepreneurs, I d… [+4474 chars]"
35,"{'id': 'business-insider', 'name': 'Business Insider'}","Huileng Tan,Beatrice Nolan",TSMC chips reportedly ended up at Huawei. It raises concerns about 'shadow networks' bypassing US sanctions.,TSMC and other chipmakers are barred from doing business with Huawei without exemptions from the US government.,https://www.businessinsider.com/tsmc-chips-huawei-export-controls-supply-chain-2024-10,https://i.insider.com/662137ed10c6b0cde5f0ac10?width=1024&format=jpeg,2024-10-24T16:50:16Z,"Taiwan Semiconductor Manufacturing Company's customers may see production delays as the chip giant reels from a powerful earthquake on the island.Chiang Ying-ying/AP
<ul><li>TSMC halted shipments to… [+5397 chars]"
36,"{'id': 'business-insider', 'name': 'Business Insider'}","Noah Sheidlower,Alice Tecotzky,Kwan Wei Kevin Tan,Beatrice Nolan",Trump 'won fair and square': Business leaders from Mark Cuban to David Sacks react to election result,Here is what some of the most influential business figures have to say about Donald Trump winning the election.,https://www.businessinsider.com/business-leaders-react-donald-trump-winning-election-silicon-valley-2024-11,https://i.insider.com/672b405f192f5258985661fa?width=1200&format=jpeg,2024-11-06T11:29:35Z,"The business world was divided in the run-up to the election.Anna Moneymaker/Getty Images
<ul><li>Business leaders have been reacting to Donald Trump's presidential election victory.</li><li>Silicon… [+8169 chars]"
37,"{'id': 'business-insider', 'name': 'Business Insider'}",ggoodwin@businessinsider.com (Grace Eliza Goodwin),Company executives are speaking out on Election Day: Starbucks' Howard Schultz calls for a peaceful transition of power,"Business leaders including Howard Schultz, Elon Musk, and Reid Hoffman weigh in on Election Day for Donald Trump, Kamala Harris — or simply peace.",https://www.businessinsider.com/election-day-executives-speak-trump-harris-starbucks-meta-musk-2024-11,https://i.insider.com/672a54c1192f5258985629c6?width=1200&format=jpeg,2024-11-05T22:01:56Z,"Election Day has finally come, and executives at some of the biggest companies are speaking out with former Starbucks CEO Howard Schultz urging a peaceful transition of power and Elon Musk reiteratin… [+8192 chars]"
38,"{'id': 'business-insider', 'name': 'Business Insider'}",mhumphries@businessinsider.com (Monica Humphries),"I paid $250 to stay in a plastic tiny house in New Zealand in the middle of winter. I thought I'd freeze, but by morning, I didn't want to leave.",Business Insider's author slept in a plastic geodesic dome full of surprising luxury perks she'd never seen in a tiny house.,https://www.businessinsider.com/geodesic-tiny-house-new-zealand-winter-review-photos-2023-1,https://i.insider.com/63ab4e8647bbe4001983799d?width=1200&format=jpeg,2024-10-24T19:34:42Z,"New Zealand is home to the most breathtaking nature I've seen.
When I visited in June 2022, my focus was to soak in every moment. I wanted to explore the country's striking mountains, lush forests, … [+236 chars]"
