,source,author,title,description,url,urlToImage,publishedAt,content
368,"{'id': None, 'name': 'Investopedia'}",Andrew Kessel,Why Super Micro Computer's Stock Is Plunging After Its Business Update Tuesday,Super Micro Computer shares plunged in extended trading Tuesday after the server maker said it's unable to predict when it will file its delayed annual...,https://www.investopedia.com/super-micro-computer-q1-fy2025-update-filing-delay-delisting-worries-8739932,https://s.yimg.com/ny/api/res/1.2/N1ZaYaBfKh3qsixbDFks_A--/YXBwaWQ9aGlnaGxhbmRlcjt3PTEyMDA7aD04MDA-/https://media.zenfs.com/en/investopedia_245/5f96f3ae7141de49a3f5760f4a173678,2024-11-05T22:37:02Z,"<ul><li>Super Micro Computer shares plunged in extended trading Tuesday after the company said it's unable to predict when it will file its delayed annual report for 2024, exacerbating delisting worr… [+2013 chars]"
369,"{'id': None, 'name': 'Yahoo Entertainment'}",,Texas real estate tycoon sent chilling texts to business partner days after wife's disappearance: docs,,https://consent.yahoo.com/v2/collectConsent?sessionId=1_cc-session_50eff87b-bbe8-491b-bd65-1bce4ccafb1e,,2024-10-23T23:48:52Z,"If you click 'Accept all', we and our partners, including 237 who are part of the IAB Transparency &amp; Consent Framework, will also store and/or access information on a device (in other words, use … [+678 chars]"
370,"{'id': None, 'name': 'Slashdot.org'}",BeauHD,"OpenAI, Microsoft Funding $10 Million In Grants For AI-Powered Journalism","OpenAI and Microsoft will give grants of up to $10 million to bring more AI tools into the newsroom. The grants will go to Chicago Public Media, the Minnesota Star Tribune, Newsday (in Long Island, NY), The Philadelphia Inquirer and The Seattle Times. ""Each o…",https://news.slashdot.org/story/24/10/22/2045216/openai-microsoft-funding-10-million-in-grants-for-ai-powered-journalism,https://a.fsdn.com/sd/topics/ai_64.png,2024-10-22T22:40:00Z,"""Would I turn on the gas if my pal Mugsy were in there?""
 ""You might, rabbit, you might!""
-- Looney Tunes, Bugs and Thugs (1954, Friz Freleng)"
371,"{'id': None, 'name': 'Hubspot.com'}",Cassie Wilson,9 Best AI Marketing Bots I Use at Work in 2024,"As a solopreneur, marketing my own business gets pushed to the back burner more times than I care to admit. There are just too many other tasks that require immediate attention. It’s why I’m a big fan of AI marketing bots.",https://blog.hubspot.com/marketing/ai-marketing-bots#article,https://www.hubspot.com/hubfs/AI-marketing-bot-1-20241021-5209923.webp,2024-10-22T11:00:00Z,"As a solopreneur, marketing my own business gets pushed to the back burner more times than I care to admit. There are just too many other tasks that require immediate attention. Its why Im a big fan … [+12986 chars]"
372,"{'id': 'business-insider', 'name': 'Business Insider'}","insider@insider.com (Juliana Kaplan,Matthew Loh)",Workers in Missouri can look forward to raises after minimum wage boosts were passed,Four states are voting on some form of a minimum wage hike. Here are the ones that have voted to pass it.,https://www.businessinsider.com/minimum-wage-vote-results-massachusetts-alaska-california-arizona-missouri-2024-11,https://i.insider.com/672aae4b88cea3ba1c1e9588?width=1200&format=jpeg,2024-11-06T07:44:15Z,"Pay is on the ballot, and some workers are set to get a raise.
Four states Massachusetts, Missouri, California, and Alaska all have some form of referendum on whether to hike the minimum wage on the… [+3345 chars]"
373,"{'id': None, 'name': '9to5Mac'}",Benjamin Mayo,Apple previews new iPhone features including enhanced caller ID for businesses and brand logos in Mail,"Apple today announced an extension of the Apple Business Connect program, which allows companies to submit information about their businesses to Apple to be surfaced in Apple Maps, Siri and increasingly more places across the operating system.



In iOS 18.2,…",https://9to5mac.com/2024/10/16/apple-brand-logos-iphone-mail-phone-caller-id/,https://i0.wp.com/9to5mac.com/wp-content/uploads/sites/6/2024/10/apple-business-logos-mail-caller-id-phone-app.jpg?resize=1200%2C628&quality=82&strip=all&ssl=1,2024-10-16T19:00:47Z,"Apple today announced an extension of the Apple Business Connect program, which allows companies to submit information about their businesses to Apple to be surfaced in Apple Maps, Siri and increasin… [+1677 chars]"
374,"{'id': None, 'name': 'Gizmodo.com'}",Matthew Gault,The Feds Are Coming for John Deere Over the Right to Repair,The farm equipment giant has fought against letting farmers repair their own equipment for years.,https://gizmodo.com/the-feds-are-coming-for-john-deere-over-the-right-to-repair-2000513521,https://gizmodo.com/app/uploads/2024/10/JohnDeereTractor.jpg,2024-10-18T13:45:32Z,The Federal Trade Commission is investigating tractor manufacturer John Deere over long standing allegations that Deere makes its farm equipment hard to repair. The investigation has been ongoing sin… [+3417 chars]
375,"{'id': None, 'name': 'Gizmodo.com'}",Isaac Schultz,Hurricane Milton’s Imminent Landfall Officially Delays NASA Mission to Jupiter,The Europa Clipper was set to launch Thursday but Mother Nature had other plans.,https://gizmodo.com/hurricane-miltons-imminent-landfall-officially-delays-nasa-mission-to-jupiter-2000508353,https://gizmodo.com/app/uploads/2024/10/kennedy-space-center-storm.jpg,2024-10-07T21:15:08Z,"NASA’s Europa Clipper, a mission set to probe Jupiter’s icy moon, will no longer launch on Thursday due to a Category 5 hurricane making its way towards Florida.
The spacecraft’s launch window opens… [+3427 chars]"
376,"{'id': None, 'name': 'Gizmodo.com'}",Kyle Barr,Microsoft’s Lunar Lake Surface Laptop Is Reportedly Going to Be Super Late,Leaked sale of a Intel Core Ultra 7 268V rendition of the Surface Laptop shows Microsoft isn’t putting all its eggs in the ARM basket.,https://gizmodo.com/microsofts-lunar-lake-surface-laptop-is-reportedly-going-to-be-super-late-2000512562,https://gizmodo.com/app/uploads/2024/10/surface-laptop-7th-edition-sapphire-13-compare-render-copilot-copy.jpg,2024-10-16T16:24:25Z,"The Microsoft Surface Laptop has its fans. It’s thin, it’s fast, and it works. The latest rendition of the laptop also bears the flag for a new generation of Qualcomms ARM-based Snapdragon Elite chip… [+2645 chars]"
377,"{'id': None, 'name': 'Gizmodo.com'}",Lucas Ropek,Why Did Kevin From The Office Call for the President of Moldova to Be Overthrown?,Celebrities have reportedly become unwitting participants in foreign influence campaigns.,https://gizmodo.com/why-did-kevin-from-the-office-call-for-the-president-of-moldova-to-be-overthrown-2000514805,https://gizmodo.com/app/uploads/2024/10/Brian-Baumgartner-at-SXSW.jpg,2024-10-22T12:50:57Z,"Since The Office ended, Brian Baumgartnerwho played the show’s subdued, perfunctory “Kevin Malone”has made a second career for himself as one of the top earners on Cameo, the website that allows cele… [+2772 chars]"
378,"{'id': None, 'name': 'Gizmodo.com'}",Germain Lussier,"Rejoice, We’re Already Getting Another Entry in the ‘Ke Huy Quan Kicks Ass’ Genre","Love Hurts is coming next year, but now the Oscar-winning Indiana Jones star has a Christmas action movie too.",https://gizmodo.com/ke-huy-quan-action-movie-fairytale-in-new-york-2000518221,https://gizmodo.com/app/uploads/2024/10/Ke-Huy-Kwan-Love-Hurts.jpg,2024-10-29T22:30:23Z,It’s happening about 40 years later than it should’ve but Ke Huy Quan is becoming a full-on action star. After winning an Oscar for his action-packed comeback role in Everything Everywhere All At Onc… [+2319 chars]
379,"{'id': None, 'name': 'Harvard Business Review'}",,How Do I Handle It When I Disagree with My Boss’s Decisions?,A leader on the fast track must learn how to align with leadership decisions while staying true to himself.,https://hbr.org/podcast/2024/10/how-do-i-handle-it-when-i-disagree-with-my-bosss-decisions,https://hbr.org/resources/images/article_assets/2023/04/wide-coaching-real-leaders_hbr.png,2024-10-21T13:02:00Z,"October 21, 2024After finishing business school, he landed several leadership positions and was fast-tracked into the executive level of his organization. But he’s been struggling to find his footing… [+233 chars]"
380,"{'id': None, 'name': 'Gizmodo.com'}",Cheryl Eddy,Amazon Has the Numbers to Keep Making Rings of Power at Scale,Prime Video remains committed to its expensive Tolkien adaptation—though there's still no official announcement about season three.,https://gizmodo.com/amazon-has-the-numbers-to-keep-making-rings-of-power-at-scale-2000511274,https://gizmodo.com/app/uploads/2024/10/Gandalf_ROP_S2.jpg,2024-10-11T20:50:30Z,"Considering the big-ticket investment Amazon Prime Video has made in The Lord of the Rings: The Rings of Power so far, it’s a little surprising the streamer hasn’t officially confirmed a third season… [+2580 chars]"
381,"{'id': None, 'name': 'Gizmodo.com'}",Matthew Gault,Former FTX Executive Is Locked-In on LinkedIn and Federal Prison,One of FTX's executives begins a seven year prison sentence with a humorous update to his LinkedIn profile.,https://gizmodo.com/former-ftx-executive-is-locked-in-on-linkedin-and-federal-prison-2000510995,https://gizmodo.com/app/uploads/2024/10/Salame.jpg,2024-10-11T13:50:33Z,Former FTX co-CEO Ryan Salame has updated his LinkedIn profile with a new role: a prisoner in a federal correctional institute. Im happy to share that Im starting a new position as Inmate at FCI Cumb… [+2884 chars]
382,"{'id': None, 'name': 'Gizmodo.com'}",Lucas Ropek,"Kamala Harris Might Keep Lina Khan at the FTC, After All","If she wins in November, there are indicators that Harris will keep the controversial FTC head, a new report claims.",https://gizmodo.com/kamala-harris-might-keep-lina-khan-at-the-ftc-after-all-2000513157,https://gizmodo.com/app/uploads/2024/10/Lina-Khan-at-the-Fast-Company-Innovation-Festival.jpg,2024-10-17T20:45:06Z,"Lina Khan, the head of the Federal Trade Commission, has proven to be a contentious figurearguably because, unlike some of the FTC chairs who came before her, she seems intent on actually doing her j… [+2894 chars]"
383,"{'id': None, 'name': 'Gizmodo.com'}",Lucas Ropek,Polymarket Is Looking Into Its Big Trump Bettors,"Recent, weirdly large pro-Trump bets have caught the attention of the platform's executives.",https://gizmodo.com/polymarket-is-looking-into-its-big-trump-bettors-2000515321,https://gizmodo.com/app/uploads/2024/10/A-Polymarket-advertisement-in-Brooklyn.jpg,2024-10-23T12:35:52Z,"Polymarket, the platform that allows web users to earn or burn cash via political bets, got spanked by a federal regulator two years ago, which accused it of providing illegal trading services. Since… [+2793 chars]"
384,"{'id': None, 'name': 'Gizmodo.com'}",Dua Rashid,Google Maps Will Use Gemini AI to Better Plan Your Night Out,It'll also (finally) inform you about lane merges in advance when you're out driving on the highway.,https://gizmodo.com/google-maps-will-use-gemini-ai-to-better-plan-your-night-out-2000518797,https://gizmodo.com/app/uploads/2024/10/google-maps-2.jpg,2024-10-31T15:08:07Z,"It was going to happen eventually; Gemini AI is making its way to Google Maps. This will give Maps two major capabilities: curating your activities and answering your queries.
Suppose your friend is… [+3117 chars]"
385,"{'id': None, 'name': 'Gizmodo.com'}",Kyle Barr,Microsoft Is One Step Closer to Opening an Actual Xbox App Store on Android,"Xbox is currently one of the few companies that doesn't let you buy games on its app, but the recent Epic v. Google decision is giving its plans for a mobile store a shot in the arm.",https://gizmodo.com/microsoft-is-one-step-closer-to-opening-an-actual-xbox-app-store-on-android-2000510988,https://gizmodo.com/app/uploads/2024/10/Samsung-Galaxy-S24-Xbox-App.jpg,2024-10-11T14:45:59Z,"After Epic Games, Xbox plans to be the next big app seller to break free of Googles shackles. Microsoft’s gaming arm announced on Twitter that it would allow Android users to purchase games for their… [+3339 chars]"
386,"{'id': None, 'name': 'Gizmodo.com'}",Passant Rabie,Here’s What the Space Station That Could Replace the ISS Looks Like,The proposed commercial space station includes familiar features like a cupola window and a large robotic arm.,https://gizmodo.com/heres-what-the-space-station-that-could-replace-the-iss-looks-like-2000511988,https://gizmodo.com/app/uploads/2024/10/Vast_Haven-2_Full_Configuration_V1.jpg,2024-10-15T18:25:23Z,"NASA’s International Space Station (ISS) has been dominating low Earth orbit for more than 25 years, housing groups of astronauts in the microgravity environment. The orbital lab’s time in space, how… [+3192 chars]"
387,"{'id': None, 'name': 'Gizmodo.com'}",Lucas Ropek,Sam Altman’s Creepy Worldcoin Project Is Now Just Called ‘World’,Does this orb look friendlier to you?,https://gizmodo.com/sam-altmans-creepy-worldcoin-project-is-now-just-called-world-2000513938,https://gizmodo.com/app/uploads/2024/10/World-Projects-New-Eye-Scanning-Orb.jpg,2024-10-21T12:45:52Z,"In between running the most powerful AI company in the world, tech billionaire Sam Altman has a number of side projects. One of them is Worldcoin, the crypto-laced effort to scan the global populatio… [+2914 chars]"
388,"{'id': None, 'name': 'Gizmodo.com'}",Gizmodo Deals,"To Help You Save This Black Friday, Costco is Offering Its Gold Membership For $20",The Costco Gold Star membership will cost you just $20 after factoring in the $45 digital gift card.,https://gizmodo.com/to-help-you-save-this-black-friday-costco-is-offering-its-gold-membership-for-20-2000519432,https://gizmodo.com/app/uploads/2024/11/costco-wholesale.jpg,2024-11-02T13:40:07Z,"As the holiday season approaches, savvy shoppers are already strategizing how to make the most of their Black Friday budgets. This year, there’s an opportunity to get ahead of the game and set yourse… [+2858 chars]"
389,"{'id': None, 'name': 'AppleInsider'}",news@appleinsider.com (Malcolm Owen),Apple CEO Tim Cook was business-focused at an early age,"Apple CEO Tim Cook was entrepreneurial from an early age, using money from a paper route to save toward his college education.Tim Cook - Image credit: AppleAs the head of a major tech company, Tim Cook has a lot of experience dealing with business decisions a…",https://appleinsider.com/articles/24/10/25/apple-ceo-tim-cook-was-business-focused-at-an-early-age,https://photos5.appleinsider.com/gallery/61527-127114-50066-98194-000-lead-Tim-Cook-xl-1-xl.jpg,2024-10-25T16:27:39Z,"Apple CEO Tim Cook was entrepreneurial from an early age, using money from a paper route to save toward his college education. 
As the head of a major tech company, Tim Cook has a lot of experience … [+1660 chars]"
390,"{'id': 'business-insider', 'name': 'Business Insider'}",Katie Balevic,A Telegram group posted what it calls 'highly classified' US documents about Israel's attack plans,"A Telegram channel shared what it says are ""highly classified"" US intelligence documents on Israel's plans to attack Iran.",https://www.businessinsider.com/iran-israel-telegram-leaked-us-intel-documents-2024-10,https://i.insider.com/67141b3fa0a0cc14f222754d?width=1200&format=jpeg,2024-10-19T21:06:30Z,"A Telegram channel posted what it says are ""highly classified"" US intelligence documents analyzing Israel's plans to attack Iran.
The channel for the ""Middle East Spectator,"" which describes itself … [+1782 chars]"
391,"{'id': 'business-insider', 'name': 'Business Insider'}",Insider Inc.,An Advertising Tail,"Help Tucker, a golden retriever, navigate the day while also learning about Amazon's Ads capabilities.",https://www.businessinsider.com/sc/anadvertisingtail,https://media.tbistatic.com/bistudios/_00/dev/Advertising%20Tail/anadvertisingtail_socialthumbnail_2x1.png,2024-10-18T19:24:15Z,"An Advertising Tail<!-- Auto browser refresh when under 800px wide on desktop --> 
function checkWidth() {
 var screenWidth = window.innerWidth;
 var isMobile = /Android|webOS|iPhone|iPad|iPod|BlackB… [+2276 chars]"
392,"{'id': 'business-insider', 'name': 'Business Insider'}",Dominick Reuter,Uber drops after its bookings results and forecast fail to impress,Uber took a hit Thursday after the ride-hailing and delivery company reported mixed third-quarter results and its outlook disappointed.,https://www.businessinsider.com/uber-drops-after-q3-bookings-results-forecast-miss-estimates-2024-10,https://i.insider.com/67238bb201ea6d83dee554b9?width=1200&format=jpeg,2024-10-31T15:41:46Z,"Dara Khosrowshahi, Uber CEO.Spencer Platt
<ul><li>Uber's stock fell Thursday after the ride-share company reported mixed third-quarter results.</li><li>Gross bookings, or the dollar value of rides a… [+1665 chars]"
393,"{'id': 'business-insider', 'name': 'Business Insider'}",Laura Italiano,Macy's accused in lawsuit of covering up 2008 sexual attack by Sean 'Diddy' Combs in Herald Square flagship store,"A man who says Combs orally raped him while he worked for Ecko accuses Macy's of keeping mum to save a Sean John deal,  lawsuit says.",https://www.businessinsider.com/macys-covered-up-2008-flagship-store-sex-attack-diddy-lawsuit-2024-10,https://i.insider.com/670d88cca70318649281be20?width=1200&format=jpeg,2024-10-15T01:13:02Z,"Sean ""Diddy"" Combs has been hit by a series of lawsuits accusing him of sexual assault.REUTERS/Lucas Jackson
<ul><li>A string of federal lawsuits out of Manhattan accuse Combs of sexual attacks dati… [+5202 chars]"
394,"{'id': 'business-insider', 'name': 'Business Insider'}",Lucia Moses,Disney's CEO plan sparks speculation on what the drawn-out Bob Iger succession means,Disney said Monday it would name a new CEO in early 2026 and appointed James Gorman as board chairman. People close to the company have questions.,https://www.businessinsider.com/disney-bob-iger-ceo-succession-plan-questions-2024-10,https://i.insider.com/6716d2a401ea6d83dee30738?width=1200&format=jpeg,2024-10-22T15:08:02Z,"Bob Iger is set to leave the company at the end of 2026.Slaven Vlasic/Getty Images
<ul><li>Disney said Monday it would name a new CEO in early 2026 and named James Gorman as board chairman.</li><li>… [+5286 chars]"
395,"{'id': 'business-insider', 'name': 'Business Insider'}",Ana Altchek,Elon Musk wins big by betting on Trump,Elon Musk will likely benefit from close ties to the president-elect and a lighter regulatory environment.,https://www.businessinsider.com/trump-won-election-what-that-means-for-elon-musk-2024-11,https://i.insider.com/67293ca588cea3ba1c1e3b03?width=1200&format=jpeg,2024-11-06T10:45:00Z,"Elon Musk invested over $130 million in pro-Trump efforts this year.Angela Weiss/AFP/Getty
<ul><li>Elon Musk used his money, power, and influence to help reelect former President Donald Trump.</li><… [+4910 chars]"
396,"{'id': 'business-insider', 'name': 'Business Insider'}",Tom Carter,Optimus robots danced on a lit-up stage and served drinks at Tesla's robotaxi event,Tesla's humanoid robot Optimus took a starring role at the company's Hollywood robotaxi event.,https://www.businessinsider.com/elon-musk-tesla-robotaxi-event-optimus-robot-serves-drinks-dances-2024-10,https://i.insider.com/6708fe72a703186492811e17?width=1200&format=jpeg,2024-10-11T10:37:57Z,"The prototype for Optimus was first revealed in September 2022.Tesla Optimus
<ul><li>Tesla's humanoid robot Optimus took a starring role at the company's Hollywood robotaxi event.</li><li>The robots… [+1791 chars]"
397,"{'id': 'business-insider', 'name': 'Business Insider'}",Pete Syme,All passengers on a flight out of Australia had to sit through an R-rated movie after an entertainment system glitch,Qantas said technical issues with the plane's in-flight entertainment meant passengers couldn't select their own movies.,https://www.businessinsider.com/qantas-apologizes-playing-r-rated-movie-every-screen-mid-flight-2024-10,https://i.insider.com/6703b368a7031864927fcabe?width=1200&format=jpeg,2024-10-07T10:32:07Z,"A Qantas Airbus A330.Kevin Carter/Getty Images
<ul><li>Qantas has apologized for playing an R-rated movie on a Sydney to Tokyo flight.</li><li>Technical issues with the in-flight system meant passen… [+1741 chars]"
398,"{'id': 'business-insider', 'name': 'Business Insider'}",Thibault Spirlet,"The Kremlin says Trump sent Putin COVID tests during the pandemic, but denies subsequent calls","The Kremlin seemingly confirmed reports that then-President Donald Trump sent COVID tests to Vladimir Putin in early 2020, for his own personal use.",https://www.businessinsider.com/kremlin-says-trump-sent-putin-covid-tests-pandemic-denies-calls-2024-10,https://i.insider.com/670644d43f2165d716df7479?width=1200&format=jpeg,2024-10-09T09:25:04Z,"Trump sent COVID tests to Putin at the height of the pandemic, according to Bob Woodward's forthcoming book.Kremlin Press Office / Handout/Anadolu Agency/Getty Images
<ul><li>The Kremlin said Trump … [+1569 chars]"
399,"{'id': 'business-insider', 'name': 'Business Insider'}",Rebecca Rommen,TGI Friday's files for Chapter 11 bankruptcy,"In the filing, the company listed both assets and liabilities as between $100 million and $500 million.",https://www.businessinsider.com/tgi-fridays-files-for-bankruptcy-2024-11,https://i.insider.com/6726015d5ec9bfa3d63b6c21?width=1200&format=jpeg,2024-11-02T11:53:47Z,"TGI Friday's filed for Chapter 11 bankruptcy.David Rogers/Getty Images
<ul><li>TGI Friday's Inc. filed for Chapter 11 bankruptcy protection on November 2.</li><li>The company listed both assets and … [+1767 chars]"
400,"{'id': 'business-insider', 'name': 'Business Insider'}","Geoff Weiss,Natalie Musumeci",CEO of aerospace company cited in SpaceX's new lawsuit is siding with Elon Musk,"The CEO of Phantom Space said he agrees with Elon Musk that the California Coastline Commission was ""blatantly political.""",https://www.businessinsider.com/aerospace-phantom-spacex-lawsuit-elon-musk-2024-10,https://i.insider.com/67100cd7a703186492834c0a?width=1200&format=jpeg,2024-10-16T21:31:32Z,"Jim Cantrell, founder and CEO of Phantom SpaceJim Cantrell
<ul><li>SpaceX compared itself to another space company in its lawsuit against a California agency.</li><li>Phantom Space CEO Jim Cantrell,… [+4755 chars]"
401,"{'id': 'business-insider', 'name': 'Business Insider'}",Kaja Whitehouse,4 trends to watch this bank earnings season,"JPMorgan kicks off bank earnings on Friday. All eyes will be on what lower interest rates may mean for dealmaking, bonuses, and more.",https://www.businessinsider.com/third-quarter-bank-earnings-expectations-trading-nii-jpmorgan-goldman-sachs-2024-10,https://i.insider.com/6706d25ba703186492809f66?width=1200&format=jpeg,2024-10-09T19:08:24Z,"Charging bullMomo Takahashi
<ul><li>JPMorgan and Wells Fargo kick off bank earnings on Friday.</li><li>Expect lots of questions about how lower rates will impact business going forward.</li><li>Inve… [+5056 chars]"
402,"{'id': 'business-insider', 'name': 'Business Insider'}","Lauren Edmonds,Tom Carter",Ex-Waymo CEO is not impressed by Tesla's Robotaxi,Elon Musk unveiled a fleet of prototype Robotaxis — officially called the Cybercab — on Thursday.,https://www.businessinsider.com/robotaxi-review-ex-waymo-ceo-krafcik-tesla-ceo-elon-musk-2024-10,https://i.insider.com/67096fcda703186492816099?width=1200&format=jpeg,2024-10-11T22:02:22Z,"Tesla showed prototypes of its Cybercab on Thursday. Tesla
<ul><li>Tesla unveiled its driverless Robotaxi at the ""We, Robot"" event on Thursday.</li><li>Waymo's ex-CEO said Tesla isn't ""serious about… [+4289 chars]"
403,"{'id': 'business-insider', 'name': 'Business Insider'}",Tom Carter,A Tesla fan experiences the Cybercab for the first time — it's a smooth ride but he wouldn't necessarily buy one,"Tesla debuted its new Cybercab, a robotaxi with no steering wheel, on Thursday.",https://www.businessinsider.com/tesla-elon-musk-fan-robotaxi-event-experiences-cybercab-2024-10,https://i.insider.com/6709325fa703186492812ac9?width=944&format=jpeg,2024-10-12T09:47:03Z,"Tesla investor Matthew Donegan-Ryan in front of a Cybercab at Tesla's 'We, Robot' event.Matthew Donegan-Ryan
<ul><li>Elon Musk unveiled Tesla's first robotaxi on Thursday. </li><li>Tesla fan and att… [+4851 chars]"
404,"{'id': 'business-insider', 'name': 'Business Insider'}",Grace Kay,"In the past week, 4 of Elon's direct reports have announced they are leaving Tesla",Eight of Elon Musk's direct reports at Tesla have left over the past year.,https://www.businessinsider.com/elon-musk-loses-4-top-executives-ahead-of-robotaxi-event-2024-10,https://i.insider.com/6703de63198738e3a70ea0ff?width=1200&format=jpeg,2024-10-08T20:59:44Z,"A fire broke out at Tesla's Fremont Factory Monday night.Steve Granitz/FilmMagic // Stephen Lam /Reuters
<ul><li>Multiple Tesla executives announced they are leaving or have left over the past week.… [+4157 chars]"
405,"{'id': 'business-insider', 'name': 'Business Insider'}",Beatrice Nolan,Google DeepMind CEO wins joint Nobel Prize in Chemistry for work on AlphaFold,Demis Hassabis and fellow DeepMinder John Jumper have won one half of the Nobel Prize in Chemistry.,https://www.businessinsider.com/google-deepmind-ceo-wins-nobel-prize-chemistry-demis-hassabis-2024-10,https://i.insider.com/670661dd198738e3a70f47cf?width=1200&format=jpeg,2024-10-09T11:34:53Z,"Google DeepMind CEO Demis Hassabis.Google
<ul><li>DeepMind researchers Demis Hassabis and John Jumper have won a share of the Nobel Prize in Chemistry.</li><li>The pair were recognized for their wor… [+1989 chars]"
